id,publisher,title,author,published_utc,article_url,tickers,image_url,description,keywords,insights
6162cc8a3ba582b7efc111ca4de4ea31f2d9a19a8208096b41fba3dc80e4e4e7,"{'name': 'The Motley Fool', 'homepage_url': 'https://www.fool.com/', 'logo_url': 'https://s3.polygon.io/public/assets/news/logos/themotleyfool.svg', 'favicon_url': 'https://s3.polygon.io/public/assets/news/favicons/themotleyfool.ico'}",34% of the S&P 500's Value Comes From Just 8 Stocks,The Motley Fool,2024-12-29T12:15:00Z,https://www.fool.com/investing/2024/12/29/34-of-the-sp-500-index-value-comes-from/?source=iedfolrf0000001,"['GOOG', 'GOOGL', 'AMZN', 'AAPL', 'META', 'MSFT', 'NVDA', 'TSLA', 'AVGO', 'RSP']",https://g.foolcdn.com/editorial/images/802196/people-computer-1.jpg,"The S&P 500 index has become highly concentrated, with just 8 stocks making up over 34% of its value. This raises concerns about the market's vulnerability to pullbacks in these 'Fateful Eight' stocks, which have outperformed the broader market. Investors may want to consider equal-weight funds to diversify their exposure.","['S&P 500', 'market concentration', 'Fateful Eight', 'equal-weight funds']","[{'ticker': 'GOOG', 'sentiment': 'positive', 'sentiment_reasoning': ""Alphabet is one of the 'Fateful Eight' stocks that have outperformed the broader market, suggesting it is a key driver of the S&P 500's recent gains.""}, {'ticker': 'GOOGL', 'sentiment': 'positive', 'sentiment_reasoning': ""Alphabet is one of the 'Fateful Eight' stocks that have outperformed the broader market, suggesting it is a key driver of the S&P 500's recent gains.""}, {'ticker': 'AMZN', 'sentiment': 'positive', 'sentiment_reasoning': ""Amazon is one of the 'Fateful Eight' stocks that have outperformed the broader market, suggesting it is a key driver of the S&P 500's recent gains.""}, {'ticker': 'AAPL', 'sentiment': 'positive', 'sentiment_reasoning': ""Apple is one of the 'Fateful Eight' stocks that have outperformed the broader market, suggesting it is a key driver of the S&P 500's recent gains.""}, {'ticker': 'META', 'sentiment': 'positive', 'sentiment_reasoning': ""Meta Platforms is one of the 'Fateful Eight' stocks that have outperformed the broader market, suggesting it is a key driver of the S&P 500's recent gains.""}, {'ticker': 'MSFT', 'sentiment': 'neutral', 'sentiment_reasoning': ""Microsoft is one of the 'Fateful Eight' stocks, but it did not outperform the broader market in 2024, suggesting it may not be as influential as the other 'Fateful Eight' stocks.""}, {'ticker': 'NVDA', 'sentiment': 'positive', 'sentiment_reasoning': ""Nvidia is one of the 'Fateful Eight' stocks that have outperformed the broader market, suggesting it is a key driver of the S&P 500's recent gains.""}, {'ticker': 'TSLA', 'sentiment': 'positive', 'sentiment_reasoning': ""Tesla is one of the 'Fateful Eight' stocks that have outperformed the broader market, suggesting it is a key driver of the S&P 500's recent gains.""}, {'ticker': 'AVGO', 'sentiment': 'positive', 'sentiment_reasoning': ""Broadcom has recently surpassed a $1 trillion market cap, joining the 'Fateful Eight' stocks that have outperformed the broader market, suggesting it is a key driver of the S&P 500's recent gains.""}, {'ticker': 'RSP', 'sentiment': 'positive', 'sentiment_reasoning': ""The article suggests that the Invesco S&P 500 Equal Weight ETF could be a good option for investors concerned about the concentration risks in the S&P 500, as it would be more resilient to a pullback in the 'Fateful Eight' stocks.""}]"
5a6e4e9ecba7bd1448a13a940a32bf55c6d97a141b95b302653a809b24ebf323,"{'name': 'The Motley Fool', 'homepage_url': 'https://www.fool.com/', 'logo_url': 'https://s3.polygon.io/public/assets/news/logos/themotleyfool.svg', 'favicon_url': 'https://s3.polygon.io/public/assets/news/favicons/themotleyfool.ico'}","The Last Time Taiwan Semiconductor Did This, the Stock Doubed in a Year",Keithen Drury,2024-12-28T12:15:00Z,https://www.fool.com/investing/2024/12/28/the-last-time-taiwan-semiconductor-did-this-the/?source=iedfolrf0000001,"['TSM', 'NVDA', 'AAPL']",https://g.foolcdn.com/editorial/images/801512/person-in-a-mask-looking-at-a-semiconductor-microchip-for-artificial-intelligence-ai.jpg,"The article discusses the potential for Taiwan Semiconductor Manufacturing (TSMC) to repeat its 2020 performance, where its stock nearly doubled. The author believes TSMC's current setup, with the upcoming launch of 2nm chips and strong demand for AI chips, is similar to the conditions that led to its success in 2020.","['Taiwan Semiconductor Manufacturing', 'TSMC', 'Nvidia', 'Apple', 'AI chips']","[{'ticker': 'TSM', 'sentiment': 'positive', 'sentiment_reasoning': ""The article suggests that TSMC's current setup, with the upcoming launch of 2nm chips and strong demand for AI chips, is similar to the conditions that led to its stock nearly doubling in 2020. The author believes TSMC is a great investment and will likely beat the market in 2025.""}, {'ticker': 'NVDA', 'sentiment': 'neutral', 'sentiment_reasoning': ""Nvidia is mentioned as one of TSMC's clients, but the article does not provide any specific sentiment or analysis for Nvidia.""}, {'ticker': 'AAPL', 'sentiment': 'neutral', 'sentiment_reasoning': ""Apple is mentioned as one of TSMC's clients, but the article does not provide any specific sentiment or analysis for Apple.""}]"
6c003dd16f1ab6f2d48ce2aa515f665a039e40844c9433702c47e685571b00cc,"{'name': 'The Motley Fool', 'homepage_url': 'https://www.fool.com/', 'logo_url': 'https://s3.polygon.io/public/assets/news/logos/themotleyfool.svg', 'favicon_url': 'https://s3.polygon.io/public/assets/news/favicons/themotleyfool.ico'}","Warren Buffett Sells Apple Stock and Buys a Restaurant Stock Up 3,100% Since Its IPO",The Motley Fool,2024-12-28T08:30:00Z,https://www.fool.com/investing/2024/12/28/warren-buffett-sell-apple-stock-buy-stock-up-3100/?source=iedfolrf0000001,"['AAPL', 'DPZ']",https://g.foolcdn.com/editorial/images/802206/investor-16.jpg,"Warren Buffett's Berkshire Hathaway continued to sell Apple stock in the third quarter, while starting a small position in Domino's Pizza. Apple's stock looks overvalued, while Domino's reputation for good value has led to consistent same-store sales growth, but the stock looks pricey at its current valuation.","['Warren Buffett', 'Berkshire Hathaway', 'Apple', ""Domino's Pizza""]","[{'ticker': 'AAPL', 'sentiment': 'negative', 'sentiment_reasoning': ""The article suggests that Apple's stock looks overvalued based on the likely trajectory of its future earnings, and that Warren Buffett made the right call in selling shares.""}, {'ticker': 'DPZ', 'sentiment': 'neutral', 'sentiment_reasoning': ""The article states that Domino's reputation for good value has led to consistent same-store sales growth, but the stock looks pricey at its current valuation.""}]"
12664169d1bfa1617af56ef32c5f8bb74074cd3d2ca3c474f0f62d228117933f,"{'name': 'Benzinga', 'homepage_url': 'https://www.benzinga.com/', 'logo_url': 'https://s3.polygon.io/public/assets/news/logos/benzinga.svg', 'favicon_url': 'https://s3.polygon.io/public/assets/news/favicons/benzinga.ico'}",US Stocks To Open Lower As Index Future Decline: Analysts Remain Upbeat About Santa Rally,Rishabh Mishra,2024-12-27T12:35:24Z,https://www.benzinga.com/markets/futures/24/12/42699993/us-stocks-to-open-lower-as-index-future-decline-analysts-remain-upbeat-about-santa-rally,"['AAPL', 'EVAX', 'SPY', 'QQQ']",https://cdn.benzinga.com/files/images/story/2024/12/27/Wall-Street_2.jpeg?width=1200&height=800&fit=crop,"U.S. stock futures declined in premarket trading on Friday, with the S&P 500 and Nasdaq Composite dipping slightly. Analysts remain upbeat about the Santa Claus Rally, noting that the final six days of the rally have been higher five out of seven times.","['US stocks', 'index futures', 'Santa Claus Rally', 'S&P 500', 'Nasdaq Composite']","[{'ticker': 'AAPL', 'sentiment': 'positive', 'sentiment_reasoning': 'The article mentions that the Nasdaq Composite has been driven by strong gains in Apple Inc.'}, {'ticker': 'EVAX', 'sentiment': 'positive', 'sentiment_reasoning': 'Evaxion Biotech A/S applied for a patent for vaccines targeting Neisseria gonorrhoeae, which is seen as a positive development for the company.'}, {'ticker': 'SPY', 'sentiment': 'neutral', 'sentiment_reasoning': 'The SPDR S&P 500 ETF Trust was up 0.04% in premarket trading, indicating a neutral sentiment.'}, {'ticker': 'QQQ', 'sentiment': 'negative', 'sentiment_reasoning': 'The Invesco QQQ Trust ETF fell 0.36% in premarket trading, indicating a negative sentiment.'}]"
7b80fb0bccccf23a0075606b7202f8f2ebf0085a5fb7cf5d8d8e6318bd54e6af,"{'name': 'The Motley Fool', 'homepage_url': 'https://www.fool.com/', 'logo_url': 'https://s3.polygon.io/public/assets/news/logos/themotleyfool.svg', 'favicon_url': 'https://s3.polygon.io/public/assets/news/favicons/themotleyfool.ico'}",Is Berkshire Hathaway a Millionaire Maker?,Leo Sun,2024-12-27T10:45:00Z,https://www.fool.com/investing/2024/12/27/is-berkshire-hathaway-a-millionaire-maker/?source=iedfolrf0000001,"['BRK.A', 'BRK.B', 'AAPL', 'AXP', 'BAC', 'BACpB', 'BACpE', 'BACpK', 'BACpL', 'BACpM', 'BACpN', 'BACpO', 'BACpP', 'BACpQ', 'BACpS', 'BMLpG', 'BMLpH', 'BMLpJ', 'BMLpL', 'MERpK', 'KO', 'CVX']",https://g.foolcdn.com/editorial/images/802121/buffett17-tmf.jpg,"Berkshire Hathaway, founded in 1993, has grown into a massive conglomerate under Warren Buffett's leadership. While it has generated massive gains for early investors, its future growth potential may be limited due to its size and the upcoming leadership transition.","['Berkshire Hathaway', 'Warren Buffett', 'Millionaire-Maker', 'Conglomerate', 'Leadership Transition']","[{'ticker': 'BRK.A', 'sentiment': 'neutral', 'sentiment_reasoning': ""The article discusses Berkshire Hathaway's past success and future growth potential. While it has generated massive gains for early investors, the article suggests that its future growth may be limited due to its size and the upcoming leadership transition.""}, {'ticker': 'BRK.B', 'sentiment': 'neutral', 'sentiment_reasoning': ""The article discusses Berkshire Hathaway's past success and future growth potential. While it has generated massive gains for early investors, the article suggests that its future growth may be limited due to its size and the upcoming leadership transition.""}, {'ticker': 'AAPL', 'sentiment': 'positive', 'sentiment_reasoning': ""The article mentions that Apple is Berkshire Hathaway's top holding, suggesting that the investment in Apple has been a positive one for Berkshire.""}, {'ticker': 'AXP', 'sentiment': 'positive', 'sentiment_reasoning': 'The article lists American Express as one of the blue-chip giants in which Berkshire Hathaway holds a stake, suggesting that the investment in American Express has been a positive one for Berkshire.'}, {'ticker': 'BAC', 'sentiment': 'positive', 'sentiment_reasoning': 'The article lists Bank of America as one of the blue-chip giants in which Berkshire Hathaway holds a stake, suggesting that the investment in Bank of America has been a positive one for Berkshire.'}, {'ticker': 'BACpB', 'sentiment': 'positive', 'sentiment_reasoning': 'The article lists Bank of America as one of the blue-chip giants in which Berkshire Hathaway holds a stake, suggesting that the investment in Bank of America has been a positive one for Berkshire.'}, {'ticker': 'BACpE', 'sentiment': 'positive', 'sentiment_reasoning': 'The article lists Bank of America as one of the blue-chip giants in which Berkshire Hathaway holds a stake, suggesting that the investment in Bank of America has been a positive one for Berkshire.'}, {'ticker': 'BACpK', 'sentiment': 'positive', 'sentiment_reasoning': 'The article lists Bank of America as one of the blue-chip giants in which Berkshire Hathaway holds a stake, suggesting that the investment in Bank of America has been a positive one for Berkshire.'}, {'ticker': 'BACpL', 'sentiment': 'positive', 'sentiment_reasoning': 'The article lists Bank of America as one of the blue-chip giants in which Berkshire Hathaway holds a stake, suggesting that the investment in Bank of America has been a positive one for Berkshire.'}, {'ticker': 'BACpM', 'sentiment': 'positive', 'sentiment_reasoning': 'The article lists Bank of America as one of the blue-chip giants in which Berkshire Hathaway holds a stake, suggesting that the investment in Bank of America has been a positive one for Berkshire.'}, {'ticker': 'BACpN', 'sentiment': 'positive', 'sentiment_reasoning': 'The article lists Bank of America as one of the blue-chip giants in which Berkshire Hathaway holds a stake, suggesting that the investment in Bank of America has been a positive one for Berkshire.'}, {'ticker': 'BACpO', 'sentiment': 'positive', 'sentiment_reasoning': 'The article lists Bank of America as one of the blue-chip giants in which Berkshire Hathaway holds a stake, suggesting that the investment in Bank of America has been a positive one for Berkshire.'}, {'ticker': 'BACpP', 'sentiment': 'positive', 'sentiment_reasoning': 'The article lists Bank of America as one of the blue-chip giants in which Berkshire Hathaway holds a stake, suggesting that the investment in Bank of America has been a positive one for Berkshire.'}, {'ticker': 'BACpQ', 'sentiment': 'positive', 'sentiment_reasoning': 'The article lists Bank of America as one of the blue-chip giants in which Berkshire Hathaway holds a stake, suggesting that the investment in Bank of America has been a positive one for Berkshire.'}, {'ticker': 'BACpS', 'sentiment': 'positive', 'sentiment_reasoning': 'The article lists Bank of America as one of the blue-chip giants in which Berkshire Hathaway holds a stake, suggesting that the investment in Bank of America has been a positive one for Berkshire.'}, {'ticker': 'BMLpG', 'sentiment': 'positive', 'sentiment_reasoning': 'The article lists Bank of America as one of the blue-chip giants in which Berkshire Hathaway holds a stake, suggesting that the investment in Bank of America has been a positive one for Berkshire.'}, {'ticker': 'BMLpH', 'sentiment': 'positive', 'sentiment_reasoning': 'The article lists Bank of America as one of the blue-chip giants in which Berkshire Hathaway holds a stake, suggesting that the investment in Bank of America has been a positive one for Berkshire.'}, {'ticker': 'BMLpJ', 'sentiment': 'positive', 'sentiment_reasoning': 'The article lists Bank of America as one of the blue-chip giants in which Berkshire Hathaway holds a stake, suggesting that the investment in Bank of America has been a positive one for Berkshire.'}, {'ticker': 'BMLpL', 'sentiment': 'positive', 'sentiment_reasoning': 'The article lists Bank of America as one of the blue-chip giants in which Berkshire Hathaway holds a stake, suggesting that the investment in Bank of America has been a positive one for Berkshire.'}, {'ticker': 'MERpK', 'sentiment': 'positive', 'sentiment_reasoning': 'The article lists Bank of America as one of the blue-chip giants in which Berkshire Hathaway holds a stake, suggesting that the investment in Bank of America has been a positive one for Berkshire.'}, {'ticker': 'KO', 'sentiment': 'positive', 'sentiment_reasoning': 'The article lists Coca-Cola as one of the blue-chip giants in which Berkshire Hathaway holds a stake, suggesting that the investment in Coca-Cola has been a positive one for Berkshire.'}, {'ticker': 'CVX', 'sentiment': 'positive', 'sentiment_reasoning': 'The article lists Chevron as one of the blue-chip giants in which Berkshire Hathaway holds a stake, suggesting that the investment in Chevron has been a positive one for Berkshire.'}]"
4fdd8629a537b98d22e768aabf3f3057f2572bf4772fc926aaa77045415115ab,"{'name': 'The Motley Fool', 'homepage_url': 'https://www.fool.com/', 'logo_url': 'https://s3.polygon.io/public/assets/news/logos/themotleyfool.svg', 'favicon_url': 'https://s3.polygon.io/public/assets/news/favicons/themotleyfool.ico'}",5 Seemingly Unstoppable Stocks I'd Sell Right Now,Sean Williams,2024-12-27T09:06:00Z,https://www.fool.com/investing/2024/12/27/5-seemingly-unstoppable-stocks-id-sell-right-now/?source=iedfolrf0000001,"['PLTR', 'NVDA', 'TSLA', 'AAPL', 'MSTR']",https://g.foolcdn.com/editorial/images/802114/investor-pressing-sell-button-getty.jpg,"The article recommends selling 5 high-flying stocks - Palantir, Nvidia, Tesla, Apple, and MicroStrategy - due to concerns over valuation, competition, and unsustainable profit sources.","['stocks', 'investing', 'market analysis', 'artificial intelligence', 'electric vehicles', 'cryptocurrency']","[{'ticker': 'PLTR', 'sentiment': 'negative', 'sentiment_reasoning': ""Palantir's Gotham platform has a limited addressable market, and a significant portion of its profits come from unsustainable interest income rather than its core business.""}, {'ticker': 'NVDA', 'sentiment': 'negative', 'sentiment_reasoning': ""Nvidia's dominance in the AI-accelerated data center market may be challenged by competition and the potential for an AI bubble burst, similar to past technology bubbles.""}, {'ticker': 'TSLA', 'sentiment': 'negative', 'sentiment_reasoning': ""Tesla's core EV production business is facing margin pressure, and a significant portion of its profits come from unsustainable sources like regulatory credits and interest income.""}, {'ticker': 'AAPL', 'sentiment': 'negative', 'sentiment_reasoning': ""Apple's growth has stalled, yet its valuation has doubled, making it overpriced compared to its operating results.""}, {'ticker': 'MSTR', 'sentiment': 'negative', 'sentiment_reasoning': ""MicroStrategy's heavy reliance on leveraged debt to acquire Bitcoin, along with a significant valuation premium on its Bitcoin holdings, make it a risky investment.""}]"
f428e184956ecd53ac4ec81b2069a001f26f27c65558c02b3950a23cab38f0a0,"{'name': 'The Motley Fool', 'homepage_url': 'https://www.fool.com/', 'logo_url': 'https://s3.polygon.io/public/assets/news/logos/themotleyfool.svg', 'favicon_url': 'https://s3.polygon.io/public/assets/news/favicons/themotleyfool.ico'}",The Bull Market Keeps Growing: 4 Reasons to Buy Amazon Like There's No Tomorrow,The Motley Fool,2024-12-26T10:20:00Z,https://www.fool.com/investing/2024/12/26/bull-market-growing-reasons-buy-amazon-stock/?source=iedfolrf0000001,"['AMZN', 'MSFT', 'GOOG', 'GOOGL', 'AAPL']",https://g.foolcdn.com/editorial/images/801960/gettyimages-1483780995.jpg,"Amazon is well-positioned to capitalize on the AI opportunity, with its cloud computing unit AWS leading the market and the company investing in AI-powered innovations across its e-commerce and logistics operations. Despite recent strong performance, Amazon's valuation remains attractive, making it a compelling long-term investment.","['Amazon', 'AWS', 'AI', 'cloud computing', 'e-commerce', 'valuation']","[{'ticker': 'AMZN', 'sentiment': 'positive', 'sentiment_reasoning': ""The article highlights Amazon's strong position in the cloud computing market through AWS, its investments in AI-powered innovations across its business segments, and its attractive valuation, suggesting the company is well-positioned to capitalize on the AI opportunity and continue its growth trajectory.""}, {'ticker': 'MSFT', 'sentiment': 'neutral', 'sentiment_reasoning': ""The article mentions Microsoft's Azure cloud platform as a competitor to AWS, but does not provide any specific commentary on Microsoft's outlook or performance.""}, {'ticker': 'GOOG', 'sentiment': 'neutral', 'sentiment_reasoning': ""The article notes that Alphabet's Google Cloud is a competitor to AWS in the cloud computing market, but does not offer any further insights on Alphabet's performance or prospects.""}, {'ticker': 'GOOGL', 'sentiment': 'neutral', 'sentiment_reasoning': ""The article notes that Alphabet's Google Cloud is a competitor to AWS in the cloud computing market, but does not offer any further insights on Alphabet's performance or prospects.""}, {'ticker': 'AAPL', 'sentiment': 'positive', 'sentiment_reasoning': ""The article mentions that Apple is a customer of Amazon's AI chips, suggesting a positive relationship and potential collaboration between the two companies.""}]"
ce710784232f872b9e9e4bc9704fdb342f5513969ab936bcd5a8d9f2ed7b5bc5,"{'name': 'The Motley Fool', 'homepage_url': 'https://www.fool.com/', 'logo_url': 'https://s3.polygon.io/public/assets/news/logos/themotleyfool.svg', 'favicon_url': 'https://s3.polygon.io/public/assets/news/favicons/themotleyfool.ico'}",4 of Wall Street's Most Prominent Artificial Intelligence (AI) Stocks Have Made a Shocking $1.23 Trillion Investment,The Motley Fool,2024-12-26T10:06:00Z,https://www.fool.com/investing/2024/12/26/4-wall-street-ai-stocks-123-trillion-investment/?source=iedfolrf0000001,"['NVDA', 'META', 'GOOG', 'GOOGL', 'AAPL']",https://g.foolcdn.com/editorial/images/802042/ai-artificial-intelligence-robots-office-working-conference-room-laptop-getty.jpg,"Four prominent AI stocks - Nvidia, Meta Platforms, Alphabet, and Apple - have collectively spent $1.23 trillion on share buybacks over the past decade, far more than they have invested in AI research and development. This suggests these companies have more cash than they know what to do with, and are using buybacks to boost earnings per share rather than focusing on AI innovation.","['artificial intelligence', 'AI', 'share buybacks', 'Nvidia', 'Meta Platforms', 'Alphabet', 'Apple']","[{'ticker': 'NVDA', 'sentiment': 'positive', 'sentiment_reasoning': 'Nvidia is a semiconductor colossus leading the AI revolution, with its AI-graphics processing units (GPUs) in high demand and its Hopper and Blackwell GPU architectures offering improved performance and efficiency.'}, {'ticker': 'META', 'sentiment': 'neutral', 'sentiment_reasoning': 'Meta Platforms is spending heavily on AI, purchasing 350,000 Hopper chips from Nvidia and developing its own AI chip, but has also prioritized share buybacks over AI research and development.'}, {'ticker': 'GOOG', 'sentiment': 'neutral', 'sentiment_reasoning': ""Alphabet is one of Nvidia's top customers and is developing its own AI chip, Trillium, but has also spent heavily on share buybacks rather than focusing solely on AI innovation.""}, {'ticker': 'GOOGL', 'sentiment': 'neutral', 'sentiment_reasoning': ""Alphabet is one of Nvidia's top customers and is developing its own AI chip, Trillium, but has also spent heavily on share buybacks rather than focusing solely on AI innovation.""}, {'ticker': 'AAPL', 'sentiment': 'neutral', 'sentiment_reasoning': ""Apple is investing in AI, using Google's tensor processing units to train its Apple Intelligence model, but has also prioritized share buybacks over AI research and development.""}]"
fc92b3492a3aa264193c0c8a6d0868eeb39a5872aeffb1526d0e5c16d97ea076,"{'name': 'The Motley Fool', 'homepage_url': 'https://www.fool.com/', 'logo_url': 'https://s3.polygon.io/public/assets/news/logos/themotleyfool.svg', 'favicon_url': 'https://s3.polygon.io/public/assets/news/favicons/themotleyfool.ico'}",Prediction: 2 AI Stocks Will Be Worth More Than Apple Stock by Year-End in 2025,The Motley Fool,2024-12-26T09:25:00Z,https://www.fool.com/investing/2024/12/26/2-ai-stocks-be-worth-more-than-apple-stock-2025/?source=iedfolrf0000001,"['NVDA', 'GOOG', 'GOOGL', 'AAPL']",https://g.foolcdn.com/editorial/images/802111/growth-23.jpg,"Nvidia and Alphabet are predicted to surpass Apple's $3.9 trillion market value by 2025, driven by their strong positions in artificial intelligence and cloud computing. Nvidia's GPUs are the industry standard for AI workloads, while Alphabet's digital advertising and cloud computing businesses are leveraging AI for growth.","['Nvidia', 'Alphabet', 'Apple', 'artificial intelligence', 'cloud computing', 'digital advertising']","[{'ticker': 'NVDA', 'sentiment': 'positive', 'sentiment_reasoning': ""Nvidia is expected to benefit from the growing demand for AI semiconductors, with its Blackwell GPU offering significant performance improvements. The company's strong position in the data center and automotive/robotics segments is driving robust financial results and earnings growth.""}, {'ticker': 'GOOG', 'sentiment': 'positive', 'sentiment_reasoning': ""Alphabet's digital advertising and cloud computing businesses are leveraging AI to create new monetization opportunities. While regulatory concerns are weighing on the stock's valuation, the article suggests these issues may be resolved by 2025, potentially leading to a higher valuation multiple for the company.""}, {'ticker': 'GOOGL', 'sentiment': 'positive', 'sentiment_reasoning': ""Alphabet's digital advertising and cloud computing businesses are leveraging AI to create new monetization opportunities. While regulatory concerns are weighing on the stock's valuation, the article suggests these issues may be resolved by 2025, potentially leading to a higher valuation multiple for the company.""}, {'ticker': 'AAPL', 'sentiment': 'neutral', 'sentiment_reasoning': 'Apple is currently the most valuable publicly traded company, but the article suggests that Nvidia and Alphabet could surpass its market value by 2025 due to their stronger positions in AI-related technologies.'}]"
