id,publisher,title,author,published_utc,article_url,tickers,image_url,description,keywords,insights,amp_url
c9cece56998aa993c064106130677ba3f07892370b2ec445296c44a3741badc6,"{'name': 'Benzinga', 'homepage_url': 'https://www.benzinga.com/', 'logo_url': 'https://s3.polygon.io/public/assets/news/logos/benzinga.svg', 'favicon_url': 'https://s3.polygon.io/public/assets/news/favicons/benzinga.ico'}","Stocks Tumble As Traders Rethink Santa Rally, Crude Tops $70, Bitcoin Slips To $94,000: What's Driving Markets Friday?",Piero Cingari,2024-12-27T18:16:21Z,https://www.benzinga.com/24/12/42708116/stocks-tumble-as-traders-rethink-santa-rally-crude-tops-70-bitcoin-slips-to-94000-whats-driving-markets-friday,"['QQQ', 'SPY', 'DIA', 'COIN', 'MSTR', 'KULR', 'LW', 'TSLA']",https://cdn.benzinga.com/files/images/story/2024/12/27/Wall-Street-subway-sign.jpeg?width=1200&height=800&fit=crop,"Stocks tumbled on Friday as investors rethought the Santa Rally, with the Nasdaq 100 falling 2% and the S&P 500 and Dow also declining. Crude oil topped $70 per barrel, while Bitcoin slipped to $94,000.","['stocks', 'Santa Rally', 'crude oil', 'Bitcoin']","[{'ticker': 'QQQ', 'sentiment': 'negative', 'sentiment_reasoning': 'The Nasdaq 100 fell 2%, indicating a significant decline in the tech-heavy index.'}, {'ticker': 'SPY', 'sentiment': 'negative', 'sentiment_reasoning': 'The S&P 500 saw notable losses, suggesting a broad-based decline in the market.'}, {'ticker': 'DIA', 'sentiment': 'negative', 'sentiment_reasoning': 'The Dow Jones also declined, indicating a bearish sentiment across major indices.'}, {'ticker': 'COIN', 'sentiment': 'negative', 'sentiment_reasoning': 'Coinbase Global Inc. fell 3.5%, indicating a bearish sentiment for the cryptocurrency-related stock.'}, {'ticker': 'MSTR', 'sentiment': 'negative', 'sentiment_reasoning': 'MicroStrategy Inc. slipped 3.6%, suggesting a negative sentiment for the company.'}, {'ticker': 'KULR', 'sentiment': 'negative', 'sentiment_reasoning': 'KULR Technology Group Inc. tumbled 7.4%, indicating a significant decline for the crypto-related stock.'}, {'ticker': 'LW', 'sentiment': 'positive', 'sentiment_reasoning': 'Lamb Weston Holdings Inc. gained 3.6% after a shareholder added a board nominee, signaling a potential positive change for the company.'}, {'ticker': 'TSLA', 'sentiment': 'negative', 'sentiment_reasoning': 'Tesla Inc. dropped 4.8% on valuation concerns, suggesting a bearish sentiment for the electric vehicle manufacturer.'}]",
12664169d1bfa1617af56ef32c5f8bb74074cd3d2ca3c474f0f62d228117933f,"{'name': 'Benzinga', 'homepage_url': 'https://www.benzinga.com/', 'logo_url': 'https://s3.polygon.io/public/assets/news/logos/benzinga.svg', 'favicon_url': 'https://s3.polygon.io/public/assets/news/favicons/benzinga.ico'}",US Stocks To Open Lower As Index Future Decline: Analysts Remain Upbeat About Santa Rally,Rishabh Mishra,2024-12-27T12:35:24Z,https://www.benzinga.com/markets/futures/24/12/42699993/us-stocks-to-open-lower-as-index-future-decline-analysts-remain-upbeat-about-santa-rally,"['AAPL', 'EVAX', 'SPY', 'QQQ']",https://cdn.benzinga.com/files/images/story/2024/12/27/Wall-Street_2.jpeg?width=1200&height=800&fit=crop,"U.S. stock futures declined in premarket trading on Friday, with the S&P 500 and Nasdaq Composite dipping slightly. Analysts remain upbeat about the Santa Claus Rally, noting that the final six days of the rally have been higher five out of seven times.","['US stocks', 'index futures', 'Santa Claus Rally', 'S&P 500', 'Nasdaq Composite']","[{'ticker': 'AAPL', 'sentiment': 'positive', 'sentiment_reasoning': 'The article mentions that the Nasdaq Composite has been driven by strong gains in Apple Inc.'}, {'ticker': 'EVAX', 'sentiment': 'positive', 'sentiment_reasoning': 'Evaxion Biotech A/S applied for a patent for vaccines targeting Neisseria gonorrhoeae, which is seen as a positive development for the company.'}, {'ticker': 'SPY', 'sentiment': 'neutral', 'sentiment_reasoning': 'The SPDR S&P 500 ETF Trust was up 0.04% in premarket trading, indicating a neutral sentiment.'}, {'ticker': 'QQQ', 'sentiment': 'negative', 'sentiment_reasoning': 'The Invesco QQQ Trust ETF fell 0.36% in premarket trading, indicating a negative sentiment.'}]",
6f466c9a02f26a448a0b5ed45fa957bde2a066a10bbea29eb445285b6d055ac9,"{'name': 'Benzinga', 'homepage_url': 'https://www.benzinga.com/', 'logo_url': 'https://s3.polygon.io/public/assets/news/logos/benzinga.svg', 'favicon_url': 'https://s3.polygon.io/public/assets/news/favicons/benzinga.ico'}","US Stocks To Open Higher On Shortened Trading Day: Santa Claus Rally Period Officially Begins, Says Analyst",Rishabh Mishra,2024-12-24T11:26:09Z,https://www.benzinga.com/24/12/42667439/us-stocks-to-open-higher-on-shortened-trading-day-as-santa-clause-rally-period-begins-says-analyst,"['AVGR', 'CREV', 'CREVW', 'NEUE', 'TIVC', 'TOVX', 'SPY', 'QQQ']",https://cdn.benzinga.com/files/images/story/2024/12/24/Wall-Street.jpeg?width=1200&height=800&fit=crop,"US stock futures are trading higher ahead of a shortened trading session on Christmas Eve. Analysts expect a 'Santa Rally' during this period, which has historically seen positive returns. However, they also caution about potential market corrections in 2025 due to stretched valuations.","['US stocks', 'Santa Claus Rally', 'market outlook', 'market correction']","[{'ticker': 'AVGR', 'sentiment': 'positive', 'sentiment_reasoning': 'The company announced it has received a Notice of Allowance for a U.S. patent, which is a positive development.'}, {'ticker': 'CREV', 'sentiment': 'positive', 'sentiment_reasoning': 'The company inked an agreement with OIC for further financing to support its ongoing liquidity, which is a positive sign.'}, {'ticker': 'CREVW', 'sentiment': 'positive', 'sentiment_reasoning': 'The company inked an agreement with OIC for further financing to support its ongoing liquidity, which is a positive sign.'}, {'ticker': 'NEUE', 'sentiment': 'positive', 'sentiment_reasoning': 'The company entered into a definitive merger to be acquired at a premium, which is a positive outcome for shareholders.'}, {'ticker': 'TIVC', 'sentiment': 'positive', 'sentiment_reasoning': ""The company's CEO outlined 2025 priorities, including a 30% reduction in net operating loss, which is a positive development.""}, {'ticker': 'TOVX', 'sentiment': 'positive', 'sentiment_reasoning': 'The company received a notice of allowance for a U.S. Patent, which is a positive development.'}, {'ticker': 'SPY', 'sentiment': 'positive', 'sentiment_reasoning': 'The ETF is trading higher in premarket, reflecting the overall positive sentiment in the market.'}, {'ticker': 'QQQ', 'sentiment': 'positive', 'sentiment_reasoning': 'The ETF is trading higher in premarket, reflecting the positive sentiment in the tech-heavy Nasdaq Composite.'}]",
e9cad2596025fb373918c01d89d9532523304f495d32504dd00c56b94e3f2771,"{'name': 'Investing.com', 'homepage_url': 'https://www.investing.com/', 'logo_url': 'https://s3.polygon.io/public/assets/news/logos/investing.png', 'favicon_url': 'https://s3.polygon.io/public/assets/news/favicons/investing.ico'}",Dow Jones: A Relevant Benchmark or a Relic of the Past?,Marketbeat.Com,2024-12-24T07:35:00Z,https://www.investing.com/analysis/dow-jones-a-relevant-benchmark-or-a-relic-of-the-past-200655611,"['SPY', 'QQQ', 'RSP', 'DIA']",https://i-invdn-com.investing.com/redesign/images/seo/investingcom_analysis_og.jpg,"The article discusses the relevance of the Dow Jones Industrial Average (DJIA) as a benchmark for the US stock market, compared to the S&P 500 index. It argues that the DJIA, with only 30 stocks, may no longer accurately represent the broader market, and the S&P 500 should be considered a more comprehensive and accurate barometer.","['Dow Jones', 'S&P 500', 'Nasdaq 100', 'index', 'benchmark']","[{'ticker': 'SPY', 'sentiment': 'positive', 'sentiment_reasoning': 'The article argues that the S&P 500 index, with 500 stocks, is a more accurate representation of the US stock market and should be the primary benchmark used by investors and fund managers.'}, {'ticker': 'QQQ', 'sentiment': 'neutral', 'sentiment_reasoning': 'The article mentions the Nasdaq 100 index as another major index, but does not make a strong argument for or against its relevance as a benchmark.'}, {'ticker': 'RSP', 'sentiment': 'positive', 'sentiment_reasoning': 'The article highlights the Invesco S&P 500 Equal-Weight ETF as a way to get an even playing field, as it tracks the S&P 500 index with equal weighting for each constituent, rather than market capitalization weighting.'}, {'ticker': 'DIA', 'sentiment': 'negative', 'sentiment_reasoning': 'The article suggests that the DJIA, with only 30 stocks, may not be an accurate representation of the broader US stock market, and that the S&P 500 index should be considered a more comprehensive and accurate benchmark.'}]",https://m.investing.com/analysis/dow-jones-a-relevant-benchmark-or-a-relic-of-the-past-200655611?ampMode=1
24162dc1a78ddc92fc75723306785c9a69df919b5e6fbd314581f6c52a0bf107,"{'name': 'Benzinga', 'homepage_url': 'https://www.benzinga.com/', 'logo_url': 'https://s3.polygon.io/public/assets/news/logos/benzinga.svg', 'favicon_url': 'https://s3.polygon.io/public/assets/news/favicons/benzinga.ico'}","US Stocks To Open Higher As Wall Street Expects 'Santa Rally' In Shortened Trading Week: MicroStrategy, Palantir, Qualcomm Among Stocks In Focus",Rishabh Mishra,2024-12-23T11:26:15Z,https://www.benzinga.com/news/earnings/24/12/42643303/us-stocks-to-open-higher-as-wall-street-expects-santa-rally-in-shortened-trading-week-microstrategy,"['ARM', 'AVXL', 'BNRG', 'LAES', 'MSTR', 'PLTR', 'QCOM', 'QQQ', 'SPY']",https://cdn.benzinga.com/files/images/story/2024/12/23/Wall-Street.jpeg?width=1200&height=800&fit=crop,"US stock futures are expected to open higher as Wall Street anticipates a 'Santa Rally' in the shortened trading week. Key stocks in focus include MicroStrategy, Palantir, and Qualcomm.","['US stocks', 'Santa Rally', 'MicroStrategy', 'Palantir', 'Qualcomm']","[{'ticker': 'ARM', 'sentiment': 'negative', 'sentiment_reasoning': 'ARM Holdings fell 3.52% in premarket trading after Qualcomm bagged a key legal win against the company.'}, {'ticker': 'AVXL', 'sentiment': 'positive', 'sentiment_reasoning': 'Anavex Life Sciences was up 0.23% in premarket as analysts expect the company to post a quarterly loss.'}, {'ticker': 'BNRG', 'sentiment': 'positive', 'sentiment_reasoning': 'Brenmiller Energy was up 32.75% after the company announced it was awarded ISO/IEC 27001:2022 certification.'}, {'ticker': 'LAES', 'sentiment': 'positive', 'sentiment_reasoning': 'Sealsq was up 31.27% after announcing the offering of 13,157,896 common stock at $1.90 per share.'}, {'ticker': 'MSTR', 'sentiment': 'negative', 'sentiment_reasoning': 'MicroStrategy fell 1.69% in premarket trade.'}, {'ticker': 'PLTR', 'sentiment': 'positive', 'sentiment_reasoning': 'Palantir Technologies was up 1.42% in premarket trade.'}, {'ticker': 'QCOM', 'sentiment': 'positive', 'sentiment_reasoning': 'Qualcomm was up 3.02% in premarket after it bagged a key win in its legal battle against ARM Holdings.'}, {'ticker': 'QQQ', 'sentiment': 'positive', 'sentiment_reasoning': 'The Invesco QQQ Trust ETF rose 0.23% in premarket trading.'}, {'ticker': 'SPY', 'sentiment': 'positive', 'sentiment_reasoning': 'The SPDR S&P 500 ETF Trust was up 0.09% in premarket trading.'}]",
8d36a69cee4d9ed7c4e18b984a84a0f716737fa691424f2e659f74d5e988a7e4,"{'name': 'Benzinga', 'homepage_url': 'https://www.benzinga.com/', 'logo_url': 'https://s3.polygon.io/public/assets/news/logos/benzinga.svg', 'favicon_url': 'https://s3.polygon.io/public/assets/news/favicons/benzinga.ico'}","Fed Cuts Interest Rates, But Powell Spoils Santa Claus Rally; Dollar Surges To Over 2-Year High, Bitcoin Sinks Below $100,000: This Week In The Market",Piero Cingari,2024-12-20T21:11:11Z,https://www.benzinga.com/news/large-cap/24/12/42629219/fed-cuts-interest-rates-but-powell-spoils-santa-claus-rally-dollar-surges-to-over-2-year-high-bitc,"['CHPT', 'GM', 'PLTR', 'SPY']",https://cdn.benzinga.com/files/images/story/2024/12/20/Businessman-Markets-Shutterstock.jpeg?width=1200&height=800&fit=crop,"The Federal Reserve cut interest rates by 25 basis points, but revised economic forecasts and Chair Jerome Powell's cautious tone dashed hopes for aggressive easing in 2025, leading to market sell-offs and a surge in the U.S. dollar.","['Federal Reserve', 'interest rates', 'economic forecasts', 'Jerome Powell', 'market sell-offs', 'U.S. dollar']","[{'ticker': 'CHPT', 'sentiment': 'positive', 'sentiment_reasoning': 'ChargePoint Holdings Inc. partnered with General Motors to deploy ultra-fast EV charging ports, which aims to enhance electric vehicle infrastructure and accelerate EV adoption.'}, {'ticker': 'GM', 'sentiment': 'positive', 'sentiment_reasoning': 'ChargePoint Holdings Inc. partnered with General Motors to deploy ultra-fast EV charging ports, which aims to enhance electric vehicle infrastructure and accelerate EV adoption.'}, {'ticker': 'PLTR', 'sentiment': 'positive', 'sentiment_reasoning': ""Palantir Technologies Inc.'s stock surged after securing a key U.S. Army deal and joining the Nasdaq-100 index, with its year-to-date gains now topping 340%.""}, {'ticker': 'SPY', 'sentiment': 'negative', 'sentiment_reasoning': ""The S&P 500, as tracked by the SPDR S&P 500 ETF Trust, tumbled 3%, recording its worst single-day drop since September 2022, as investors recalibrated their expectations following the Federal Reserve's revised economic forecasts and Chair Jerome Powell's cautious tone.""}]",
28b06749b58f83ec1941e830046e90f751cd9c2b6ff4183359cc5bcf603f6dec,"{'name': 'Benzinga', 'homepage_url': 'https://www.benzinga.com/', 'logo_url': 'https://s3.polygon.io/public/assets/news/logos/benzinga.svg', 'favicon_url': 'https://s3.polygon.io/public/assets/news/favicons/benzinga.ico'}","'Sticky Inflation' Appears 'Less Stuck' After November Consumer Price Data, Expert Says",Erica Kollmann,2024-12-20T17:02:12Z,https://www.benzinga.com/news/econ-s/24/12/42623608/sticky-inflation-appears-less-stuck-after-november-consumer-price-data-expert-says,"['SPY', 'QQQ']",https://cdn.benzinga.com/files/images/story/2024/12/20/Recession-And-Inflation-In-Us-Economy--F.jpeg?width=1200&height=800&fit=crop,Experts say 'sticky inflation' appears to be easing after November's consumer price data came in cooler than expected. This could impact the Federal Reserve's policy decisions in 2025.,"['inflation', 'Federal Reserve', 'consumer price data']","[{'ticker': 'SPY', 'sentiment': 'positive', 'sentiment_reasoning': 'The SPDR S&P 500 ETF is up 1.7% following the release of the cooler-than-expected consumer price data, indicating a positive market reaction.'}, {'ticker': 'QQQ', 'sentiment': 'positive', 'sentiment_reasoning': 'The Invesco QQQ Trust, which tracks the Nasdaq 100 index, is up 1.8% following the release of the consumer price data, suggesting a positive market sentiment.'}]",
90dda105e681bf5e53e84b65311e5edb98e38f9432e82ff0c83949c07deb13fe,"{'name': 'Benzinga', 'homepage_url': 'https://www.benzinga.com/', 'logo_url': 'https://s3.polygon.io/public/assets/news/logos/benzinga.svg', 'favicon_url': 'https://s3.polygon.io/public/assets/news/favicons/benzinga.ico'}","Market Volatility Halts On Soft Inflation Data, Yet Traders Remain Wary Of Fighting The Fed: 10 ETFs Moving Friday",Piero Cingari,2024-12-20T15:14:16Z,https://www.benzinga.com/economics/macro-economic-events/24/12/42619788/market-volatility-halts-on-soft-inflation-data-yet-traders-remain-wary-of-fightin,"['DIA', 'SPY', 'QQQ', 'VNQ', 'IWM', 'TLT', 'IBIT']",https://cdn.benzinga.com/files/images/story/2024/12/20/Bitwise-Ethereum-Strategy-ETF-AETH.jpeg?width=1200&height=800&fit=crop,"The November PCE index rose 2.4% annually, undershooting the 2.5% forecast, easing market jitters. However, traders remain cautious as the Fed maintains a hawkish stance, with the central bank reiterating its commitment to achieving the 2% inflation target.","['inflation', 'Federal Reserve', 'PCE index', 'market volatility', 'ETFs']","[{'ticker': 'DIA', 'sentiment': 'neutral', 'sentiment_reasoning': 'The article does not provide a specific sentiment for this ETF, but rather discusses the broader market performance.'}, {'ticker': 'SPY', 'sentiment': 'neutral', 'sentiment_reasoning': 'The article states that the S&P 500 index, as tracked by the SPY ETF, edged up but was down by 0.4% for the day.'}, {'ticker': 'QQQ', 'sentiment': 'positive', 'sentiment_reasoning': 'The article notes that tech stocks, as represented by the Nasdaq QQQ Trust, fared better, adding 0.6% and recovering from steeper pre-market declines.'}, {'ticker': 'VNQ', 'sentiment': 'positive', 'sentiment_reasoning': 'The article mentions that the real estate sector was the strongest-performing, with the Vanguard Real Estate ETF rising by 1.1%.'}, {'ticker': 'IWM', 'sentiment': 'positive', 'sentiment_reasoning': 'The article states that small-cap stocks, as tracked by the iShares Russell 2000 ETF, showed the largest rebound, rising by 0.1%.'}, {'ticker': 'TLT', 'sentiment': 'positive', 'sentiment_reasoning': 'The article notes that the iShares 20+ Year Treasury Bond ETF increased by 0.8% as the yield on the 30-year Treasury bond dropped five basis points to 4.70%.'}, {'ticker': 'IBIT', 'sentiment': 'neutral', 'sentiment_reasoning': 'The article notes that the iShares Bitcoin Trust trimmed premarket losses to 0.9%, as the largest cryptocurrency surged back above $95,000 levels.'}]",
da3394323cea98444dca059dfdf733a24b0cbeaa5cc69eb7ed9345074b09d86f,"{'name': 'Benzinga', 'homepage_url': 'https://www.benzinga.com/', 'logo_url': 'https://s3.polygon.io/public/assets/news/logos/benzinga.svg', 'favicon_url': 'https://s3.polygon.io/public/assets/news/favicons/benzinga.ico'}",Fed's Preferred Inflation Gauge Falls More Than Expected: Markets Breathe Sigh Of Relief,Piero Cingari,2024-12-20T13:44:16Z,https://www.benzinga.com/economics/macro-economic-events/24/12/42615908/feds-preferred-inflation-gauge-falls-more-than-expected-markets-breathe-sigh-of-r,['SPY'],https://cdn.benzinga.com/files/images/story/2024/12/20/inflation-fed-shutter.jpeg?width=1200&height=800&fit=crop,"The Federal Reserve's key inflation measure, the Personal Consumption Expenditures price index, grew less than expected in November, providing relief to markets after the central bank's hawkish stance earlier this week.","['inflation', 'Federal Reserve', 'interest rates', 'markets']","[{'ticker': 'SPY', 'sentiment': 'positive', 'sentiment_reasoning': 'The S&P 500 futures trimmed premarket losses after the softer-than-expected inflation data, indicating a positive market reaction.'}]",
d5c99318669cfdb33dddb5ea693fdd41be20c1f0f9a5fcd878efb0899a9601db,"{'name': 'Benzinga', 'homepage_url': 'https://www.benzinga.com/', 'logo_url': 'https://s3.polygon.io/public/assets/news/logos/benzinga.svg', 'favicon_url': 'https://s3.polygon.io/public/assets/news/favicons/benzinga.ico'}",US Stocks To Open Lower As Traders Brace For 'Triple Witching' Hour: Analyst Says End Of The Year Recovery 'Would Not Surprise Anyone',Rishabh Mishra,2024-12-20T10:37:57Z,https://www.benzinga.com/24/12/42611748/us-stocks-to-open-lower-as-traders-brace-for-triple-witching-hour-analyst-says-end-of-the-year-recovery-would-not,"['SPY', 'QQQ', 'BB', 'CCL', 'NKE', 'FDX', 'HUMA', 'HUMAW', 'PBM', 'PBMWW']",https://cdn.benzinga.com/files/images/story/2024/12/20/Wall-Street.jpeg?width=1200&height=800&fit=crop,"U.S. stock futures declined ahead of the 'Triple Witching' hour, with the market expected to see the expiry of about $6.6 trillion options. Analysts have mixed views on the market's recovery by the end of the year.","['US stocks', 'Triple Witching', 'market recovery', 'Fed rate cuts']","[{'ticker': 'SPY', 'sentiment': 'negative', 'sentiment_reasoning': 'The SPDR S&P 500 ETF Trust was down 1.16% in premarket trading.'}, {'ticker': 'QQQ', 'sentiment': 'negative', 'sentiment_reasoning': 'The Invesco QQQ Trust ETF fell 1.23% in premarket trading.'}, {'ticker': 'BB', 'sentiment': 'negative', 'sentiment_reasoning': 'BlackBerry was down 5.03% as it expects lower-than-expected fourth-quarter revenue.'}, {'ticker': 'CCL', 'sentiment': 'negative', 'sentiment_reasoning': 'Carnival fell 1.11% as it is expected to report quarterly earnings.'}, {'ticker': 'NKE', 'sentiment': 'negative', 'sentiment_reasoning': 'Nike was down 3.37% after issuing lower revenue guidance and additional gross margin pressure.'}, {'ticker': 'FDX', 'sentiment': 'positive', 'sentiment_reasoning': 'FedEx was 7.33% higher after posting stronger-than-expected results for its second quarter and announcing a plan to separate FedEx Freight.'}, {'ticker': 'HUMA', 'sentiment': 'positive', 'sentiment_reasoning': 'Humacyte was up 52.31% in premarket after receiving FDA approval for its bioengineered human tissue product.'}, {'ticker': 'HUMAW', 'sentiment': 'positive', 'sentiment_reasoning': 'Humacyte was up 52.31% in premarket after receiving FDA approval for its bioengineered human tissue product.'}, {'ticker': 'PBM', 'sentiment': 'positive', 'sentiment_reasoning': 'Psyence Biomedical was up 105% in premarket after signing an IP licensing and exclusivity agreement with Optimi Health.'}, {'ticker': 'PBMWW', 'sentiment': 'positive', 'sentiment_reasoning': 'Psyence Biomedical was up 105% in premarket after signing an IP licensing and exclusivity agreement with Optimi Health.'}]",
