symbol,date,headline,summary,url
AAPL,1734943355,Apple approaches $4 trillion valuation as investors bet on AI momentum,"Apple is closing in on a historic $4 trillion stock market valuation, powered by investors cheering progress in the company's long-awaited AI enhancements to rejuvenate sluggish iPhone sales. ...",https://finnhub.io/api/news?id=b6dbf4308f09255f9d4187d919aa3afef1b3c5ad4a872ed9292bb91ef7e3f147
AAPL,1734933000,Hartford Growth Opportunities Fund Q3 2024 Commentary,"The Hartford Growth Opportunities Fund (I Share) underperformed the Russell 3000 Growth Index during the quarter, however delivered overall positive returns. Read more here.",https://finnhub.io/api/news?id=54f9d904961b49bbf5bdaf2ca2c5ab979fb0d4fcf62f6e5860e7c3dab31aa30e
AAPL,1734922870,Apple in talks with Tencent and ByteDance to roll out AI features in China,Copyright © Emerce 2023Apple is in talks with Tencent and TikTok owner ByteDance about integrating their artificial intelligence models into iPhones sold in China.The American company this month...,https://finnhub.io/api/news?id=9f851eca52ded6e9372ae8e1aca020032e81bf6ed9100360fc843ad0f92032b0
AAPL,1734880902,Why Apple’s (AAPL) AI Push Could Be the Key to Dominating the Market?,"We recently published a list of 10 Buzzing AI Stocks on Latest News and Ratings. In this article, we are going to take a look at where Apple Inc. (NASDAQ:AAPL) stands against other buzzing AI stocks on latest news and ratings. Predictions of artificial intelligence reaching human-level intelligence have been made for over 50 years. […]",https://finnhub.io/api/news?id=9b22c56accada3c07678a463ce28fb1a51d309c58f980bb60184977e46850011
AAPL,1734877811,Spotify stock is trading at all-time highs just 2 years after a record low. Here's how it got there.,"Spotify has staged an epic comeback, with its stock price increasing sixfold over the past two years. But the journey to get here hasn't been easy.",https://finnhub.io/api/news?id=024bda50c758826ca09a2a9d9278579b4ca6e3b9910eb74de0a36d7c9040be85
AAPL,1734876000,"If You’re Checking That Bag, It Had Better Have an AirTag",Make sure the battery isn’t low and turn on Lost Mode—even if the luggage isn’t lost—for more frequent alerts.,https://finnhub.io/api/news?id=db8e40f1b5dbaddaf5f58c5508a08b8f90e7ebcb1ca3f264b3a6a8ca1139af2f
AAPL,1734869640,Hartford Core Equity Fund Q3 2024 Commentary,US equities rose for the fourth consecutive quarter to register a robust year-to-date gain. Read more here.,https://finnhub.io/api/news?id=60a72fe50fe9c3101d9e14aecc26668448fed7e2d62a9e95cc90beff98ec5618
AAPL,1734868800,Apple’s App Store Puts Kids a Click Away From a Slew of Inappropriate Apps,"An analysis recommends that Apple, an emerging target for digital-safety advocates, apply an independent review for software age ratings.",https://finnhub.io/api/news?id=fd59ca1159245a1efdc32a878b38adbf96ad93ff7844cf00893286561bce0d4a
AAPL,1734863400,"Steve Ballmer, the Non-Investing Guru of Investing",There is one very glaring exception:  Steve Ballmer.  The former  Microsoft  chief executive has put nearly all his eggs in one basket and kept them there for years.  Ballmer has virtually no exposure to alternative investments.,https://finnhub.io/api/news?id=b03b4a584a407dfb7fb9fc4149fc4916d742169197e931e35be35ac1e83e16c2
AAPL,1734862320,Hartford Dividend And Growth Fund Q3 2024 Commentary,Hartford Dividend and Growth Fund (I Share) outperformed the S&P 500 Index for the quarter. Read more here.,https://finnhub.io/api/news?id=d6b91e66b60ce817a196dda9fc9d7700bac525efdc0602ae0536a1c3c842d8b1
AAPL,1734860400,Here's the Average Net Worth by Age and 5 Ways to Make Money in 2025 and Beyond,"The Federal Reserve conducts its Survey of Consumer Finances (SCF) every three years.  The report provides a snapshot of the financial conditions of U.S. households, measuring income, assets, and debt across various demographic categories.  The median net worth among U.S. families at the time was $192,700.",https://finnhub.io/api/news?id=021e6a65c198906a6bbdc1397306f840e9403c3ba9af8bb01505074acb0b5b4b
AAPL,1734858000,"CII: 8.5% Income, 7% Discount, And Lower Volatility","Discover BlackRock Enhanced Capital and Income Fund Inc, offering an 8.5% income yield with a 7% discount. Click for my updated look at the CII CEF.",https://finnhub.io/api/news?id=cc8687ab521f1a65a21b6b3495ff41f00f68d625f10bc6460311616dcc14972a
AAPL,1734857640,Hartford Capital Appreciation Fund Q3 2024 Commentary,Hartford Capital Appreciation Fund (I Share) outperformed the Russell 3000 Index during the quarter. Read more here.,https://finnhub.io/api/news?id=d1e2be2b8e7b7c860b397d3067fac8b2ac00b75bd1662ee8df521506f16b6ec3
AAPL,1734829200,Apple’s $1 Billion Investment May Be Fleeting Win for Indonesia,(Bloomberg) -- Most Read from BloombergReviving a Little-Known Modernist Landmark in BuffaloThe Architects Who Built MiamiHo Chi Minh City Opens First Metro Line After Years of DelayNew York’s Congestion Pricing Plan Still Faces Legal HurdlesNew York City’s Historic Preservation Movement Is Having a Midlife CrisisIndonesia claimed victory after Apple Inc. offered to increase its investment in the country to $1 billion to get President Prabowo Subianto’s government to lift a ban on the sale of iP,https://finnhub.io/api/news?id=308246e1f5e16a25a07a44fb7454f21487d38c6de4f121886025be8077e87c67
AAPL,1734777077,Jim Cramer on Apple Inc. (AAPL): ‘I Say Own It Don’t Trade It. . . It’s So Far The Biggest Position In Our Trust’,"We recently compiled a list of the Jim Cramer Latest Stocks: 23 Stocks He Just Talked About. In this article, we are going to take a look at where Apple Inc. (NASDAQ:AAPL) stands against the other stocks Jim Cramer recently talked about. With the Federal Reserve’s December meeting over, Wall Street has now shifted into a […]",https://finnhub.io/api/news?id=0315086d755caea89ea21cd9fe5fa2f0b7b2b432ff1e760b8e600ffb09cdc1ce
AAPL,1734775200,3 new Mac menu bar shortcuts will make you even more productive in 2025,"Quicker, easier ways to access passwords, maintain focus, and look stuff up.",https://finnhub.io/api/news?id=ebbe9b3f1512e3c6d37828c11a8a49a516cb1f5a353cccea423c9cab85b45f99
AAPL,1734774900,Apple avoids iPhone 16 ban in Indonesia with $1 billion investment,Copyright © BusinessAMBE 2023Key takeawaysApple is poised to lift the ban on iPhone 16 sales in Indonesia thanks to a significant investment proposal worth $1 billion.The proposed investment...,https://finnhub.io/api/news?id=f75c6bff4cd06a0f749e1fb3f368077a6b068f3ac58de257226f59e5c7f4f33e
AAPL,1734773400,25% of Warren Buffett-Led Berkshire Hathaway's $299 Billion Portfolio Is Invested in Only 1 Stock,"Thanks to his unbelievable track record of compounding capital over many decades as the CEO of Berkshire Hathaway, Warren Buffett is probably the most closely watched investor out there.  One of Buffett's best bets has been to buy shares in Apple (NASDAQ: AAPL), the dominant consumer-electronics enterprise.  Berkshire first purchased the stock in the first quarter of 2016, and since the start of that year, Apple has soared 862% (as of Dec. 17), meaningfully outperforming the S&P 500.",https://finnhub.io/api/news?id=69fd2061824d136b723eec0fa4856414ce8af2bb7f419cfe895e6cdb84f644a0
AAPL,1734773400,"If I Had To Invest $100,000 In A Dividend Growth Portfolio Right Now, Here's What I Would Buy","The methodology uses earnings yield, dividend yield, and 5-year dividend CAGR to score and rank 55 stocks across all 11 sectors.",https://finnhub.io/api/news?id=d5eae36fb2c4b242a6ff797ba27a3c5c004e126d305bd97ae5534840b428cb85
AAPL,1734769200,Will This Incredibly Cheap Artificial Intelligence (AI) Stock Soar in 2025?,"This has turned out to be a forgettable year for Qorvo (NASDAQ: QRVO) investors as shares of the chipmaker are down 38% as of this writing, which is in stark contrast to the 23% gains clocked by the PHLX Semiconductor Sector index in 2024.  Known primarily for supplying smartphone chips to the likes of Apple (NASDAQ: AAPL) and Samsung, shares of Qorvo plunged  following the release of the company's fiscal 2025 second-quarter results in October.  Let's see why that was the case and check if Qorvo can ride the growing demand for artificial intelligence (AI)-enabled smartphones and witness a turnaround in its stock market fortunes next year.",https://finnhub.io/api/news?id=054a9ffb6ed13ef84ffeb7af9423efee204775977d352454c996f2b2ef1d1ff5
AAPL,1734746400,The Next Great Leap in AI Is Behind Schedule and Crazy Expensive,"OpenAI has run into problem after problem on its new artificial-intelligence project, code-named Orion.",https://finnhub.io/api/news?id=fbe1a9e38448610bdf3bd75a8c767d892ac688d4a67a748529b840bb154bbce6
AAPL,1734736176,Apple Defies Gravity As New Threats Are Not Priced In,Apple (AAPL) stock faces challenges in China and Wearables segment. The iPhone and Services segment has performed well in the recent quarter. See more here.,https://finnhub.io/api/news?id=839ec11bbd5d93b024cf7aad15efadf46f3420af2ae488599f54f78f525be387
AAPL,1734725700,ChatGPT: Everything you need to know about the AI-powered chatbot,"ChatGPT, OpenAI’s text-generating AI chatbot, has taken the world by storm since its launch in November 2022. What started as a tool to supercharge productivity through writing essays and code with short text prompts has evolved into a behemoth with 300 million weekly active users. 2024 has been a big year for OpenAI, from its partnership with Apple for its generative AI offering, Apple Intelligence, the release of GPT-4o with voice capabilities, and the highly-anticipated launch of its text-to-",https://finnhub.io/api/news?id=47c49f28a93f237015ee97feea575789e194d7e3b161a614e3b4a5baa0fe204c
AAPL,1734715389,"Tesla recall, Netflix-FIFA deal, Apple: Market Minute","Yahoo Finance host Rachelle Akuffo tackles three of the top trending stories and stock tickers as part of today's Market Minute. Tesla (TSLA) has recalled nearly 700,000 of its EV, deploying a software update for its Cybertruck, Model 3, and Model Y vehicles. Netflix (NFLX) signs an exclusive streaming deal with FIFA to broadcast the 2027 and 2031 Women's World Cups. Apple (AAPL) is reportedly in talks with Chinese-owned Tencent (0700.HK, TCEHY) and TikTok parent ByteDance to integrate their AI models into iPhones in China. To watch more expert insights and analysis on the latest market action, check out more Wealth here. This post was written by Luke Carberry Mogan.",https://finnhub.io/api/news?id=639ecb310de23af61448d2eded26c9e1ddaa8756bb8e8b25eba2b3e25693c258
AAPL,1734714054,San Francisco Fed president Mary Daly: We want to finish the inflation fight,San Francisco Fed president Mary Daly tells Yahoo Finance the Fed has further room to push down interest rates to keep the economy growing while still not stoking renewed inflation.,https://finnhub.io/api/news?id=49667b6746bcee5ac65789344956be03283b5847df2b0ed29bb885b47e99dab9
AAPL,1734712740,Buffett Violates Own Rule in Buying Occidental Stock,Buffett Violates Own Rule in Buying Occidental Stock,https://finnhub.io/api/news?id=002f4f28ee40441fad0d7a3918fab55a624b746bab621b4345f73218cc1c1c56
AAPL,1734704786,The 2025 Outlook: A Bear Market And The S&P 500 At 4100,A 2025 market prediction that has the S&P 500 to fall to 4100 in 2025 amid earnings decline and P/E contraction. Read what investors need to know.,https://finnhub.io/api/news?id=485151045c29b1209b5d8c6865b5083b3a6e6be1c4fdd3b0e92199ccf4a2d430
AAPL,1734696909,Apple explores AI integration with Tencent and ByteDance,Sources indicate that Apple's discussions are in the early stages.,https://finnhub.io/api/news?id=5495006daec8abcf9a0924b39b26317f482c88bc0b79cfb982fdef403f33f30c
AAPL,1734695460,"Apple talks with Tencent, ByteDance to integrate AI in iPhones, Reuters says","Apple (AAPL) is in talks with Tencent (TCEHY) and ByteDance about integrating their AI models into iPhones sold in China, Laim Mo and Brenda Goh of Reuters reports, citing three sources familiar with the matter. Apple started the rollout of OpenAI’s ChatGPT onto its devices this month. ChatGPT is not available in China and the country’s regulatory requirements that generative AI services must obtain government approval before public release has pushed Apple to seek local partners for its AI feat",https://finnhub.io/api/news?id=bb9f083ed7bbc04b440893ce344d2b5bbff276a5d0c9223e7103fb63e3c04374
AAPL,1734695100,AMD: Don't Be Fooled By The Naysayers,Advanced Micro Devices stock has struggled to regain momentum as investors are increasingly concerned about its AI growth inflection. Learn more on AMD stock here.,https://finnhub.io/api/news?id=a20fcb21038ee082008bb832a0c9cf1cc5afcf68bceb20921217f73c0cc1e8b9
AAPL,1734689220,Sell Costco Stock. It’s No Bargain.,Sell Costco Stock. It’s No Bargain.,https://finnhub.io/api/news?id=62e3a41d965346add2a41d85bfee673966264c4d988a8a1bd1dc96c0bab681f5
AAPL,1734687000,Tencent teams with smartphone maker Honor on AI while Apple searches for a partner,"Chinese technology giant Tencent Holdings announced on Friday a new strategic partnership with smartphone maker Honor for cloud computing and artificial intelligence (AI), giving a boost to a domestic rival to Apple, which has yet to settle on a partner to launch AI on iPhones in the country. Shenzhen-based Tencent said in a post on its official WeChat account that the ""long-term collaboration"" with Honor, a spin-off smartphone brand from Huawei Technologies, will see the deep integration of its",https://finnhub.io/api/news?id=a5f777a7b3b3a6c0e3d3fd2567bb9c7dd1e29e9dd0f8148e5f99968510f7724b
AAPL,1734654780,Apple AI tool falsely announces death of trending murder suspect,An artificial intelligence platform has come under fire for a humiliating mistake.,https://finnhub.io/api/news?id=f7a86bda36aa8fe2a0afefdbe8eaeaeebde2791677fcf874e15229c28103a1c9
AAPL,1734654613,Larry Ellison Once Considered Buying Apple In Order To Make Steve Jobs The CEO Again: 'My Idea Was Simple...',"Larry Ellison and Steve Jobs once devised a plan to rescue Apple Inc. and reinstate Jobs as CEO during the company’s challenging times. What Happened: In a 2016 commencement speech at USC, Ellison, who co-founded Oracle Corporation, recounted a pivotal conversation with Jobs in 1995. At the time, Apple was struggling, and Ellison proposed buying the company to make Jobs CEO. “My idea was simple, buy Apple, and immediately make Steve CEO. Apple wasn't worth much back then, about $5 billion dollar",https://finnhub.io/api/news?id=393042344e11516d433c4e92d12f17b9327310c901f34fb26d08158d28c52dac
AAPL,1734648320,Apple (AAPL) Rises As Market Takes a Dip: Key Facts,"Apple (AAPL) closed the most recent trading day at $249.79, moving +0.7% from the previous trading session.",https://finnhub.io/api/news?id=705961e7c63591f0b6b803f0f948670a2d08a25611086da40958462765f663a1
AAPL,1734638226,Apple (AAPL) In Talks With ByteDance and Tencent For Generative AI In China,"Apple Inc. is in talks with Tencent Holdings Ltd and ByteDance Ltd over the use of their AI models in products they will sell in China. The talks are at a preliminary stage, but show how Apple is shifting strategically towards compliance with local laws and finding appropriate partners in this challenging market. Apple Inc. […]",https://finnhub.io/api/news?id=c175bdd3bc7a43e8bdd5585833cc49bd5e569368f2102eefa798f879d9c2adc4
AAPL,1734637020,We asked 5 AI chatbots to pick stocks for 2025. Here's what they said,"The year 2025 is virtually here, bringing with it a wave of curiosity from investors eager to see what the stock market holds.",https://finnhub.io/api/news?id=369129275eed35370142f88cdefebc3cd83263f4c8050342606d5a2fe2387ff8
AAPL,1734635700,Tech is a 'strong play' for 2025 after the Fed's 'hawkish cut',"All three of the major indexes (^DJI,^GSPC, ^IXIC) rebound from a selloff fueled by the Federal Reserve's 2025 forecast coming in more hawkish than expected. Haywood Wealth Management president and co-founder Justin Haywood joins Wealth! Host Brad Smith to break down what investors should consider when positioning their portfolio. ""I would call yesterday's move a hawkish cut,"" Haywood says, adding, ""I think the Fed was probably reluctant to make this cut. They may have backed themselves into a corner in a sense with their rhetoric in September. And I think they felt like they needed to make this cut."" Looking forward to 2025, he says, ""the sentiment should be relatively bullish"" despite uncertainty around President-elect Donald Trump's policies. ""You want to ride this out,"" he tells Yahoo Finance. Haywood outlines his top picks, saying, ""Technology remains a strong play moving into 2025."" He names Apple (AAPL), Tesla (TSLA), and Palantir (PLTR). To watch more expert insights and analysis on the latest market action, check out more Wealth here. This post was written by Naomi Buchanan.",https://finnhub.io/api/news?id=ffb820a7fb5b0b060a4572af2575e313040794c0e928629ecda02758be615c6a
AAPL,1734633300,Apple and Meta Are Squabbling Again. This Is Why.,"The companies have been arguing over user privacy since 2021, when the iPhone maker launched App Tracking Transparency.",https://finnhub.io/api/news?id=4ef51fa1cc8cc23008617d1a59cd69503e4bee4f3dee20dfc844e3c7ca20a1f5
AAPL,1734631889,"Dan Niles Says Apple (AAPL) New iPhone Features Weren’t ‘Particularly Good’, Highlights Slowing Growth","We recently published a list of Wall Street Analysts Can’t Stop Talking About These 10 AI Stocks. In this article, we are going to take a look at where Apple Inc (NASDAQ:AAPL) stands against other stocks Wall Street analysts can’t stop talking about. Henry Ajder, Latent Space Advisory founder, said in a latest program on […]",https://finnhub.io/api/news?id=f48b5c3a7878b7c583dc4514306ac6558e11393cd744043f95a55b8e1239ea20
AAPL,1734020313,"Dow Jones Stocks: Amazon, Apple Rise; Nvidia Sells Off","With the Dow Jones Industrial Average looking to end the year with solid gains, the best Dow Jones stocks to watch in December 2024 are Amazon.com, Apple, Nvidia, Salesforce, Sherwin-Williams and Travelers.",https://finnhub.io/api/news?id=054ef063817db270bb41e0ce76c8c130b195e8df858f6be003fd1a347b240bb4
AAPL,1734627697,Tencent Stock Gains After Report Of Early AI Talks With Apple. Baidu Stock Falls.,Apple is reportedly in talks with Chinese technology firms Tencent and the privately-held ByteDance about using the companies' AI models for iPhones in China.  Tencent stock gained following the news.  Apple has already started integrating AI features into iPhones in the U.S. using OpenAI's ChatGPT models.,https://finnhub.io/api/news?id=c0d9de88dd7de0d63b720e6cc5c13af7e49fdad678da4f43c4335b4195ffde1a
AAPL,1734626454,10 Biggest Losers of Dow's 10-Day Losing Streak,10 Biggest Losers of Dow's 10-Day Losing Streak,https://finnhub.io/api/news?id=1744983193e57c6675215a4d22ddff069eefd1f49ee00e9eb7dacd5cc9608bb5
AAPL,1734626084,"Apple's AI Talks in China Deal Blow to Baidu Shares, Dips 4%","Apple Turns to Tencent, ByteDance for AI, Shaking Up Baidu's Prospects",https://finnhub.io/api/news?id=95c1ef32cc8b5f8bab4127db527fc62622e1a5c1644537f29bd040bceab8fb5b
AAPL,1734625920,Apple Inc. stock outperforms competitors on strong trading day,Apple Inc. stock outperforms competitors on strong trading day,https://finnhub.io/api/news?id=1d01b813204df2861416c7428d2c739adabce00e9b2ec9507ed7503d750b7cc6
AAPL,1734622595,Apple finally added ChatGPT to the iPhone. There's no guarantee it’ll boost sales.,Apple's latest Apple Intelligence updates include ChatGPT integration and the company's visual intelligence. Here's what it's like to use them.,https://finnhub.io/api/news?id=ab295973270cb19a757c8d1dc7a5b2c09cd20f4efbf434e9b9bfa0fc51eb6d00
AAPL,1734622179,"Mag 7 gains are supported by Fed's rate cuts, but not dependent","As investors digest the Federal Reserve's 2025 rate cut outlook, Catalysts co-host Madison Mills takes a look at the performance of the ""Magnificent Seven,"" a group made up of Nvidia (NVDA), Alphabet (GOOG, GOOGL), Tesla (TSLA), Microsoft (MSFT), Amazon (AMZN), Meta (META), and Apple (AAPL), in 2024. To watch more expert insights and analysis on the latest market action, check out more Morning Brief here. This post was written by Naomi Buchanan.",https://finnhub.io/api/news?id=8ac2b814a51f8c75f708003d6e5bb1dfa6902e2a59e9024d419273dc452b0fd7
AAPL,1734621295,Apple Boosts Indonesian Investment Proposal to $1 Billion Amid iPhone 16 Ban,"The ban, imposed in October 2024, stemmed from non-compliance with local content rules.",https://finnhub.io/api/news?id=5ed6f6ebad488e6da96d4deea645c1b25d2ce7787c2ab5571b1ab13f82df3e25
AAPL,1734621167,European Commission Seeks Feedback on Apple Interoperability Measures,The European Commission said Thursday it has invited interested parties to submit feedback on the me,https://finnhub.io/api/news?id=e007d967433457cfadcd47f4838a97c56adaab45afbf46bdca3da9fec4d52424
AAPL,1734620909,Privacy at Stake? Apple Challenges EU Rules Over Meta's Push for iOS Integration,"Apple warns EU interoperability rules may risk user privacy, targets Meta's access requests as concerning",https://finnhub.io/api/news?id=8959603af78f9391d0baf301084dfcb54cc4e6dd41c84403bc4ded8e9fdb0569
AAPL,1734620400,2025 Aston Martin Vantage Coupe: Rowdier and More Stylish Than Ever,"For the redesigned Vantage, Aston Martin has refined the look and feel of the cabin and boosted performance to a freakish 656 hp. Dan Neil buckles up and blasts off.",https://finnhub.io/api/news?id=b591b9c368362ffa003e379b36d76924eaa6d2069a773e43056a17d4c845cee0
AAPL,1734619083,"Markets Tanked After The Fed Cut Rates, But What's Really Changed?","Financial markets reacted to FOMC meeting with few surprises, raising questions about risks and potential Fed rate hikes. Read what investors need to know.",https://finnhub.io/api/news?id=1a216d2fabbb177a57889fa40f529586c3a209c6657cd2c46a9045fb1fb2302d
AAPL,1734617741,Apple complains Meta requests risk privacy in spat over EU efforts to widen access to iPhone tech,"Apple complained that requests from Meta Platforms for access to its operating software threaten user privacy, in a spat fueled by the European Union's intensifying efforts to get the iPhone maker to open up to products from tech rivals.  The 27-nation EU's executive Commission is drawing up “interoperability"" guidelines for Apple under its new digital competition rulebook.  The interoperability measures would ensure that devices like smartwatches or features like wireless file transfers work as smoothly with iPhones as do Apple Watches or AirDrop.",https://finnhub.io/api/news?id=dd93722b3196376f57635d4e5cc2ba241a63298fe31412e45dfe968c8cfba4b4
AAPL,1734617603,"Stock futures recover, government shutdown, Micron: 3 Things","US stock futures (ES=F, NQ=F, YM=F) are staging a slow recovery from yesterday's sell-off fueled by the Federal Reserve's latest interest rate cut and forecasts that illustrate the central bank's plans to cut less in 2025. Backing President-elect Donald Trump's sentiments, Elon Musk is a pivotal voice in opposing House Speaker Mike Johnson's (R) proposed funding deal, intensifying worries of a government shutdown over this weekend right before the holidays. Micron Technology (MU) shares fall lower after releasing fiscal second quarter revenue forecasts that fell below Wall Street expectations. Nike (NKE) is set to report earnings after Thursday's market close. To watch more expert insights and analysis on the latest market action, check out more Morning Brief here. This post was written by Luke Carberry Mogan.",https://finnhub.io/api/news?id=59b8116c1839318cb644598b34ec602ab585be9912734f4012c22151f8759778
AAPL,1734615137,Nvidia stock rebounds after broad market rout as analysts stay bullish on outlook,Nvidia stock rose as Wall Street analysts reiterated their Buy ratings despite concerns about rising competition and the possibility that AI chip demand could wane.,https://finnhub.io/api/news?id=ec376db4cb38f18e68a6aeb2149411077c43e77b882c9e6372e2691fd8e032a2
AAPL,1734614828,European Commission hearing feedback on Apple's compliance with rivals,Apple is facing a review on Thursday from the European Commission with questions on how to make its products work better with rivals to comply with the Digital Markets Act.The commission is seeking...,https://finnhub.io/api/news?id=e2776edb11dda3b82b5136693fe63485ee1ede019c743147be39abd1d9b1347f
AAPL,1734614713,Apple Discontinues iPhone Subscription Service Amidst Record Revenue Growth,The discontinuation of the subscription service suggests a strategic reassessment.,https://finnhub.io/api/news?id=6db56da44956d008aad64c70010f0c7e5dac9f97158e8f874c88ab21048ad342
AAPL,1734612775,Jim Cramer Thinks Apple (AAPL) Will Benefit Under Trump’s Era – Here’s Why,"We recently compiled a list of the 10 Important Stocks that Jim Cramer is Talking About. In this article, we are going to take a look at where Apple Inc (NASDAQ:AAPL) stands against the other important stocks that Jim Cramer is talking about. Jim Cramer in a latest program talked about the latest market volatility and […]",https://finnhub.io/api/news?id=f2e19287bbdddb281a7d616a93ce02ebdfbedd71b8a8732a669330c90222d9d5
AAPL,1734611354,EU asks for views on plan to force Apple to open up iOS,"The European Commission has published draft proposals for how Apple must meet interoperability requirements flowing from the bloc's Digital Markets Act (DMA), inviting feedback on proposed measures targeted at areas like iOS notifications, data transfer, and device set-up by January 9, 2025. European Union regulators have until around mid-March to adopt final decisions on what measures the bloc will expect Apple to take, and by when, to deliver access for rivals, as the DMA demands. Apple's iOS,",https://finnhub.io/api/news?id=dff09c806d45c81130f46aadaea878fa35ff59aca6fdb8c8d92efcf8ddedb159
