symbol,date,headline,summary,url
AAPL,1734610683,The BATMMAAN tech stocks this strategist has his eye on,"Step aside Magnificent Seven, the BATMMAAN is here! No, not everyone's favorite dark and brooding caped crusader, but the latest rebranding of the top tech stock leaders and outperformers, now including a rising favorite in the AI chip space: Broadcom (AVGO), Apple (AAPL), Tesla (TSLA), Microsoft (MSFT), Meta Platforms (META), Amazon (AMZN), Alphabet (GOOG, GOOGL), and Nvidia (NVDA). Freedom Capital Markets chief global strategist Jay Woods speaks with Yahoo Finance about his position on several of the BATMMAAN components. ""The one stock in this group that no one's really talking about too much is Apple. Apple is at $3.8 trillion [market cap]. It's the third biggest in the XLK (XLK) now because they've repositioned that in July,"" Woods tells Catalysts host Madison Mills. ""And to me that is a utility stock that just continues to climb. It's AI story is really just coming to our phones as every upgrade comes to our phone."" ""The potential on that upgrade cycle and the utility factor that it's been, leads me to believe this could be a $5 trillion company by the end of 2025."" Also catch Freedom Capital Markets chief global strategist Jay Woods why the sudden downturn in Nvidia shares and the Dow Jones Industrial Average (^DJI) may not be such a cause for alarm as investors think: ""To me, this is just a pause."" To watch more expert insights and analysis on the latest market action, check out more Catalysts here. This post was written by Luke Carberry Mogan.",https://finnhub.io/api/news?id=9720e4e3b3ac4b95c0c4dc0cead57435acdc4aba767a45a68a05716dec0f5b8d
AAPL,1734609600,Prediction: Warren Buffett Will Sell All of His Apple Stock in 2025,"Apple (NASDAQ: AAPL) has been one of Berkshire Hathaway's (NYSE: BRK.A) (NYSE: BRK.B) most successful investments.  After all, Buffett and his team have been incredibly complimentary toward Apple CEO Tim Cook and the business he's created there.  Berkshire Hathaway first took a position in Apple stock in the first quarter of 2016.",https://finnhub.io/api/news?id=4367e012fc4c5b1422ee39b9abe69927eece0c2c97b76325a8e8dbaa60fa3b04
AAPL,1734590700,Apple Faults Meta for Interoperability Requests,"Apple called out Meta for seeking access to software tools that it said could compromise user privacy, a criticism that comes as the EU advances efforts to force the iPhone maker to give developers greater access to its technology.",https://finnhub.io/api/news?id=685859ed07e6a378b467bac438ec6074d3b4a04a49aca801d40c0573f3a09a50
AAPL,1734603600,"Billionaire Israel Englander Sells Apple Stock and Buys an Index Fund That Could Soar 180%, According to a Wall Street Analyst","Israel Englander is the CEO of Millennium Management, the second most profitable hedge fund in history as measured by net gains since inception, according to LCH Investment.  In total, Millennium owns more than 6,000 stocks, index funds, and options, but Englander downsized one of his largest positions in the third quarter.  Specifically, he sold 11.5 million shares of Apple (NASDAQ: AAPL), reducing his stake by 90%.",https://finnhub.io/api/news?id=e93557d44ca4b895dc0390c8c7f617a05b6b96feb540c5fef8b9378539684aea
AAPL,1734602100,Impax Large Cap Fund Q3 2024 Commentary,Impax Large Cap Fund outperformed its benchmark during the third quarter of 2024. Click here to read the full commentary.,https://finnhub.io/api/news?id=262b6c662d798de56c042027bbc0a6ddb6cfde5f9e1a1c6232148abad1ca3272
AAPL,1734591554,Apple: preliminary conclusions of the European Commission,The European Commission announces that it has sent its preliminary findings to Apple in two specification procedures opened in September 2024. These findings set out measures to ensure the...,https://finnhub.io/api/news?id=e5e57c24ef3753044108d00f06232553523e000e94508f1871d39cef91648b8f
AAPL,1734590820,Apple Faults Meta for Software-Access Requests as EU Crackdown Looms,Apple Faults Meta for Software-Access Requests as EU Crackdown Looms,https://finnhub.io/api/news?id=e09dd6fbb1654498f8dfbdb7f83ac30f1efc676d3c0a6a8610e5382da54344d3
AAPL,1734590780,Apple Faults Meta for Interoperability Requests as EU Crackdown Looms -- Update,"By Kimberley Kao and Edith Hancock Apple called out Meta Platforms for trying to gain access to key software tools on iPhones, a criticism that comes as the European Union is ramping up its...",https://finnhub.io/api/news?id=80c46044abe1cd7c701fcddb47bc61468350822a93c5a624ad2dde046b453f69
AAPL,1734589593,"India gears up for a potential trade deal as Trump targets China, say government sources","India is preparing to offer tariffs cuts on some farm and other goods mainly imported from the U.S., aiming to clinch a broader trade and investment deal once president-elect Donald Trump takes...",https://finnhub.io/api/news?id=c85d089feaba099adaa9e3d606ae73c94f601c5b76483fdbb3639564a0ea507f
AAPL,1734584725,Taiwan Semiconductor Almost Doubled In 2024 - What's Next For 2025,"Taiwan Semiconductor, the world's largest chip foundry, has outperformed the S&P 500 and tech sector in 2024. Read why I assign a buy rating for TSM stock.",https://finnhub.io/api/news?id=f063eff7b950246b41ebaf094874992d0fcf62fadb04658916d7705af012619c
AAPL,1734583661,Broadcom: Joining The $1 Trillion Club,,https://finnhub.io/api/news?id=3e1b02df2a60935adeb79b1deb1694608228771114aea7a61485d4ec20c5841c
AAPL,1734583025,The Intersection of Tech and Arts: Chancellor Woodson Talks Innovation with Apple COO Jeff Williams,"As the chief operating officer at Apple, Jeff Williams oversaw the development of the Apple Watch. But before working at one of the world's biggest tech companies, Williams was a student at the NC...",https://finnhub.io/api/news?id=f80357ee350f3757a1d5dc4ceaa3c1e2953e3ff12c98dee4693b59af9cb2832c
AAPL,1734580080,Apple: Insourcing Can Structurally Lift Gross Margins,Apple is starting to reduce networking component dependency on its suppliers as it transitions toward in-house manufacturing. Read why AAPL stock is a Buy.,https://finnhub.io/api/news?id=f28f6ecb3aaee0a1782c08543be82d1a88ed049ca86e6fd9f1d7b84e036fc8ac
AAPL,1734565178,"Apple in talks with Tencent, ByteDance to roll out AI features in China, sources say","Apple is in talks with Tencent and TikTok owner ByteDance about integrating their artificial intelligence models into iPhones sold in China, according to three sources familiar with the matter. ...",https://finnhub.io/api/news?id=ac9fd62deead6e0b94fbc357846562e2021044531d7bdd0b87fad765dc767c75
AAPL,1734563064,Tracking Bruce Berkowitz's Fairholme Portfolio - Q3 2024 Update,Fairholmeâs 13F stock portfolio value rose from $1.39B to $1.46B in Q3 2024. Click here to read more about the holdings and trades of the portfolio.,https://finnhub.io/api/news?id=6a3ee502fdde76d38d29244fe57ee63faf8665ec20b1471151af03fc9d37e1fe
AAPL,1734562391,Apple hits out at Meta's numerous interoperability requests,"BRUSSELS (Reuters) -Apple on Wednesday hit out at Meta Platforms, saying its numerous requests to access the iPhone maker's software tools for its devices could impact users' privacy and security, underscoring the intense rivalry between the two tech giants.  Under the European Union's landmark Digital Markets Act that took effect last year, Apple must allow rivals and app developers to inter-operate with its own services or risk a fine of as much as 10% of its global annual turnover.  Meta has made 15 interoperability requests thus far, more than any other company, for potentially far-reaching access to Apple's technology stack, the latter said in a report.",https://finnhub.io/api/news?id=9f1c9e12995a83c80b15faaddec61e83388ed40970b51dd263502d47340aef3c
AAPL,1734561694,The top 3 features from Apple’s latest iOS update,"Apple (AAPL) has released its second wave of artificial intelligence features in iOS 18.2 across Mac, iPad, and iPhone devices. Yahoo Finance Tech Editor Dan Howley joins Asking for a Trend to demonstrate the top three new features: ChatGPT integration, Genmoji, and Visual Intelligence. Howley also explores additional capabilities, including App Intention—which enables Siri to perform specific tasks within apps—and enhanced personal content usage for improved task automation. To watch more expert insights and analysis on the latest market action, check out more Asking for a Trend here. This post was written by Angel Smith",https://finnhub.io/api/news?id=1c54c3a8b138021ddaf32a196dc3b9f23ffb8a0a91a6a20db1472880b61b0e77
AAPL,1734558620,Apple Intelligence Still Not Driving iPhone Sales. AI Upgrade Cycle Yet To Arrive.,Apple's iPhone 16 sales are lagging last year's models possibly due to low consumer awareness of AI features.,https://finnhub.io/api/news?id=cda0722fdcfb8ca32bb15be40afe559804a3a04497365ce9e2f1cd695519d429
AAPL,1734556463,"Nvidia stock rebounds amid bullish analyst outlooks, then falters after Fed decision",Nvidia stock rose as Wall Street analysts reiterated their Buy ratings despite concerns about rising competition and the possibility that AI chip demand could wane.,https://finnhub.io/api/news?id=ae8a4e64c7a31baf367000f1123a53c58070588e3479639b45ae6f3ed306f974
AAPL,1734553766,Update: Market Chatter: Apple Halts Work on iPhone Hardware Subscription Service,(Updates with details throughout and recent stock movement in final paragraph.) Apple (AAPL) has,https://finnhub.io/api/news?id=a5bb0df25bf2dc0004cf88193a6240bdd6a6f0509e8c5cae6a60ae1ae041ee9e
AAPL,1734553585,"App downloads decline 2.3% in 2024, but consumer spending grows to $127B","The global app economy continued to recover in 2024, after an earlier slowdown in 2022 — at least in terms of consumer spending. In 2024, global consumer spending in mobile apps and games reached $127 billion across the App Store and Google Play, up 15.7% from the prior year. However, those increases were driven by Apple's App Store, as Google Play spending declined, according to new data from app intelligence firm Appfigures. Though spending was up, there was another worrying sign about the ove",https://finnhub.io/api/news?id=96cfd70323e911454f6d5a8b4a5d46e5d22cdd9b6b63e4a26c6f8694ef4a58d3
AAPL,1734549709,Apple Halts Effort to Build iPhone Hardware Subscription Service,"(Bloomberg) -- Apple Inc. has halted work on a project to build an iPhone hardware subscription service, according to people familiar with the matter, retreating from an attempt to change the way consumers buy its flagship device.Most Read from BloombergNYPD Car Chases Are Becoming More Frequent — and More DangerousThe idea was to make owning an iPhone like subscribing to an app — with consumers paying monthly fees and getting new phones each year — but Apple recently wound down the effort, acco",https://finnhub.io/api/news?id=a38d6cdd896ff30664ac2cc02e8d2c2e6662971d0bc28844ebc12e0684fd57bb
AAPL,1734547625,"Apple Faces Criminal Complaints, Develops Foldable iPad Amid More Than 35% YTD Gain",The Democratic Republic of Congo has filed criminal complaints against Apple's subsidiaries in France and Belgium.,https://finnhub.io/api/news?id=74fcdb0d75b5023c99ce000d1d06f84570002ed85ac79b1aef55d0687ba55463
AAPL,1734546160,Apple iPhone 16 Market Share Struggles Amid Low Consumer Awareness,Apple's iPhone 16 is underperforming in market share compared to the iPhone 15 cycle.,https://finnhub.io/api/news?id=2411007af6e0a162313d202abb8a77025e5fecd018a94ee650318ed58912105d
AAPL,1734544800,"Market concentration woes overblown, instead celebrate Mag 7 wins","The ""Magnificent Seven"" — made up of Nvidia (NVDA), Alphabet (GOOG, GOOGL), Tesla (TSLA), Microsoft (MSFT), Amazon (AMZN), Meta (META), and Apple (AAPL) — have led the market (^DJI,^GSPC, ^IXIC) higher in 2024. While the narrow leadership has raised some concerns about concentration and broadening trading themes, Baird Investment strategist Ross Mayfield tells Brad Smith and Madison Mills on Morning Brief that these worries may be overblown. ""It's certainly something we keep an eye on, but I would say that if you had been worried about that concentration or used it as a reason to get out of the market at any point over the last couple of years, it would have been a mistake,"" Mayfield says. The strategist believes investors ""should be celebrating that some of the biggest and most innovative companies are in our markets. Concentration risk, or heavy concentration, has not been a good forward indicator over the last 40 or 50 years based on the data that we've seen."" ""It's something to keep an eye on [as] it maybe makes the market a little bit more fragile to something like Nvidia having a bad stretch run, but it's not something that we worry about too much,"" Mayfield adds. Watch the video above for more about Mayfield's Magnificent Seven outlook and what's next for the artificial intelligence (AI) trade. To watch more expert insights and analysis on the latest market action, check out more Morning Brief here. This post was written by Naomi Buchanan.",https://finnhub.io/api/news?id=d087e9f235194fcae3c9f7a9279fccc96067157e3f4c96d95cb07c16a8bb7c5a
AAPL,1734544391,Apple slams Meta's numerous interoperability requests,"Apple on Wednesday hit out at Meta Platforms, saying its numerous requests to access the iPhone maker's software tools to its devices could impact users' privacy and security, underscoring the intense...",https://finnhub.io/api/news?id=38f95871d08fb4cddbf77cc310c58b573c8b0fb7606fa05bb4a8a1d8422140ee
AAPL,1734543000,Supreme Court to Consider TikTok Ban,The court scheduled fast-track oral arguments for Jan. 10 on whether the law violates the First Amendment.,https://finnhub.io/api/news?id=4e630127b923fb45b8d22134a0c4a7c0218425ec51cb7bfdf00485dadb9e5619
AAPL,1734539789,"JPMorgan Reiterates Overweight on Apple Inc. (AAPL), Predicts AI-Driven Growth with iPhone 17 Launch","We recently compiled a list of the Top 12 AI Stock News and Ratings Dominating Wall Street. In this article, we are going to take a look at where Apple Inc. (NASDAQ:AAPL) stands against the other AI stocks. There is a growing concern in Silicon Valley that the progress around artificial intelligence is slowly “losing steam”. […]",https://finnhub.io/api/news?id=bef380316e6fe6d0ac76c92c0b660f8d7e77777727efe83f05f558291e3f91f5
AAPL,1734539520,Apple Inc. stock outperforms competitors despite losses on the day,Apple Inc. stock outperforms competitors despite losses on the day,https://finnhub.io/api/news?id=25f5e3aa6b13e38eb1b206fb96ab1fc7ad168b8a28030fcc887400972ce671f6
AAPL,1734538312,"Apple Intelligence Struggles to Lift iPhone 16 Sales, J.P. Morgan Reports",iPhone 16 Struggles: Pro Max Tops Sales While Awareness Stays Low,https://finnhub.io/api/news?id=f6836445105c84b25e4e3d799afc4777d45ea9e1be1a2cabeac8d91c8fab564a
AAPL,1734537916,Warren Buffett Defense Pick Finds Key Support After Earnings Skid,Warren Buffett Defense Pick Finds Key Support After Earnings Skid,https://finnhub.io/api/news?id=ffea014ae9b2cdb865baada5192655dc552191ed569ebfd9bdcbace3cdcda963
AAPL,1734536880,Amazon Stock Is a 2025 ‘Best Idea’ for Several Analysts. Meta Is Also a Top Pick.,Amazon Stock Is a 2025 ‘Best Idea’ for Several Analysts. Meta Is Also a Top Pick.,https://finnhub.io/api/news?id=74d0f57b266aeafc849176e5601dd55b91de7c10a40a1ca1d99708d7e9e00ab3
AAPL,1734535475,FTEC: Technology Dashboard For December,"All tech subsectors are significantly overvalued based on their historical averages, with the semiconductor industry as the least compelling. Click for more.",https://finnhub.io/api/news?id=c3f84a51a630adee60fc6895a9e17d4a2828a03517067a37a408ab707f982f95
AAPL,1734535430,Why JPMorgan predicts an AI trade shift in 2025,"JPMorgan (JPM) has released a new report suggesting the artificial intelligence landscape will enter a transformative phase in 2025. The analysis highlights emerging players like Amazon (AMZN), Meta (META), Spotify (SPOT), and Alphabet (GOOG, GOOGL), signaling a potential shift away from traditional AI infrastructure powerhouses such as Nvidia (NVDA). Yahoo Finance markets and data editor Josh Schafer breaks down the report's key insights, examining how the AI investment landscape is evolving from infrastructure-focused plays to companies actively monetizing AI technologies. To watch more expert insights and analysis on the latest market action, check out more Morning Brief here. This post was written by Angel Smith",https://finnhub.io/api/news?id=4988f6086ee48cc4fddde6bf6cd5856f991d7e9068de6d3db86a41dd6dea0a6e
AAPL,1734534487,"How To Invest In 2025: As Nvidia Blinks, Draw Lines, Not Conclusions","How To Invest In 2025: As Nvidia Blinks, Draw Lines, Not Conclusions",https://finnhub.io/api/news?id=a59b0683358a3300c0798ea0127ceaeadc9cfd0ce18ae6c5dc0031d4da7982be
AAPL,1734534384,Why the Mag 7 trade is far from over: Chart of the Day,"Bank of America (BAC) released its Global Fund Manager Survey on Tuesday, offering market insights from top institutional, mutual, and hedge fund managers. Today's Chart of the Day features anchor Madison Mills examining the increasing allocation to the Magnificent Seven stocks — Apple (AAPL), Meta Platforms (META), Amazon (AMZN), Microsoft (MSFT), Alphabet (GOOG, GOOGL), Nvidia (NVDA), and Tesla (TSLA) — and exploring the potential for continued growth in this investment trend. To watch more expert insights and analysis on the latest market action, check out more Morning Brief here. This post was written by Angel Smith",https://finnhub.io/api/news?id=4d8a7c76b62a0a1ac54705c932e8d5a269dadb566bc8499c17b624e9f1110cc9
AAPL,1734528420,"Buffett Goofed by Selling Apple Stock Instead of Occidental, but All Isn’t Lost","Buffett Goofed by Selling Apple Stock Instead of Occidental, but All Isn’t Lost",https://finnhub.io/api/news?id=44a6573d9733f170aa59151150066f84a63ec7ddc62243d9f10746c614939c88
AAPL,1734526815,Apple Inc. (NASDAQ:AAPL) is a favorite amongst institutional investors who own 61%,Key Insights Significantly high institutional ownership implies Apple's stock price is sensitive to their trading...,https://finnhub.io/api/news?id=429a3b782995f671e838c60889e58752bc355aeb192f2537bb604f668e2cf2fe
AAPL,1734524068,Top Senate Republican urges Supreme Court to reject TikTok appeal,Top Senate Republican Mitch McConnell on Wednesday urged the U.S. Supreme Court to reject a bid by TikTok and its China-based parent company ByteDance to block a law intended to force the sale of the...,https://finnhub.io/api/news?id=938d6db070898f3a48071e15637ff9f61ea030580258b34889e585d24f7364c4
AAPL,1734522816,Reverse-Engineering Tesla's $1.5T Valuation,"Tesla, Inc. stock continues to trade at all-time highs with increased confidence in its autonomous mobility future under the Trump administration. Read more here.",https://finnhub.io/api/news?id=a9677a7f6aa82b8ca62e8ae74955031bcf9d7fe034892d16e43e974acc85a129
AAPL,1734521880,Foxconn Has Discussed Making Bid for Nissan,"The electronics manufacturer has been considering acquiring Nissan as part of plans to expand its nascent electric-vehicle business, according to people familiar with the matter.",https://finnhub.io/api/news?id=67da2742f9e247e44623b39ad2fccf109b3034eb2e414dd352896071c69728df
AAPL,1734519640,Big Tech is dominating the market once again — and that's probably just fine: Morning Brief,December is shaping up to be a tale of two markets.,https://finnhub.io/api/news?id=afdb150fc4253a22b608586043be5c9e846b07ddf9c76d6de078ed5a2cf199b6
AAPL,1734519000,Meet the 3 Artificial Intelligence (AI) Stocks Dan Ives Says Will Become The First Members of the $4 Trillion Club in 2025,"In areas including software, hardware, cloud computing, social media, e-commerce and more, all of these companies are playing major roles in the AI revolution.  Dan Ives, a managing director and senior analyst at Wedbush Securities, recently published his top 10 predictions for the tech sector in 2025.  While it's clear that Ives is bullish on the industry as a whole, he foresees AI tailwinds propelling Apple (NASDAQ: AAPL), Microsoft (NASDAQ: MSFT), and Nvidia (NASDAQ: NVDA) into the $4 trillion club next year.",https://finnhub.io/api/news?id=2a9b0f3caea455e7e17eb7d4cd9ce4b63515ec1b0268361731fe1a2012548c10
AAPL,1734519000,The Gabelli Growth Fund Q3 2024 Commentary,"The Gabelli Growth Fund (class I) returned 0.87% for the third quarter of 2024. Click here to read the full commentary. 
",https://finnhub.io/api/news?id=59814581654cd262c800ea15833ef67564affcf70af4fff652d3a9a44136f5aa
AAPL,1734517800,2024 Has Been a Year of Extremes in the Stock Market. Can It Last?,"As extended as some trends have become this year, investors shouldn’t assume that they are about to revert to the mean.",https://finnhub.io/api/news?id=7af26554a486f9a242a7782148181c1d263fd55311b396f1fc57eba3be305bd8
AAPL,1734517800,What Would Apple Stock Be Worth Without A Profitable Business - Morphing Into Collector Markets,"Apple stock stands to gain as financial markets morph into collector markets, where some securities hold value beyond business fundamentals. Read my analysis of AAPL.",https://finnhub.io/api/news?id=a5bfb50c2c48f4ea4b5cfaee022157221e04ffb145143966717c32ab110cba41
AAPL,1734516000,The Gabelli Dividend Growth Fund Q3 2024 Commentary,"The Gabelli Dividend Growth Fund (class I) returned 5.01% for the third quarter of 2024. Click here to read the full commentary. 
",https://finnhub.io/api/news?id=f21477405c696a8edcb7056ab970dc66c60ee82ccfbaa507105f8aab27b5b46b
AAPL,1734515880,Broadcom Stock Has Surged. Can It Shake Up the Mag 7?,Broadcom Stock Has Surged. Can It Shake Up the Mag 7?,https://finnhub.io/api/news?id=37751f758fdeac9812935b7fcef5a07cf8cd7cc4eb76cccd80f2bae3f0d4a545
AAPL,1734509826,Congo lawyers say Apple's supply chain statement must be verified,"International lawyers for the Democratic Republic of Congo welcomed Apple's decision to stop sourcing minerals from there due to worsening conflict, but said they would press ahead with their cases...",https://finnhub.io/api/news?id=e4446e3257be25d167337b88886fb95af1b18ea194f28ff6e0fc78042a9167ba
AAPL,1734509707,Samsung and Google debut Gemini AI in XR headset,"Google will integrate Gemini AI into its extended reality (XR) platform, Android XR, via Samsung's Project Moohan XR headset. This collaboration between Samsung and Google shows a shared vision for a cohesive AI experience across various devices.",https://finnhub.io/api/news?id=d01d2bdea5ff311389922e9eb31084ec05df9e5aa655fd3169b21cd27309f961
AAPL,1734509400,My Dividend Stock Portfolio: New November Dividend Record - 97 Holdings With 18 Buys,"Financial writer achieves record dividend income in November through investments in BDCs, inching closer to $10,000 annual goal.",https://finnhub.io/api/news?id=1622bfcd6476b1f6935d84f1ad53065555594e875fe18e2d92fb59ae55233c0a
AAPL,1734505500,Why The Market May Get Turned Upside Down In 2025,"AI stocks have dominated the market in 2024, dragging the S&P 500 higher with them. Find out why I think the market may get turned upside down in 2025.",https://finnhub.io/api/news?id=3f95c277ed09437ac4ed0fa712cfcf3c9f0df132d0f78975e67ed665a55bbcfc
AAPL,1734505291,China pressures Apple with advanced AI phones for low prices,Copyright © BusinessAMBE 2023Key takeawaysAnalysts predict a wave of new smartphone releases following the celebration of Chinese New Year.Apple's share of the Chinese market is down 2.6...,https://finnhub.io/api/news?id=937b7f53c8e6fdb607a4bacb0d55bf56a5ae10ec3818d40dd551868a6a02dc8b
AAPL,1734504240,"The Dow’s Losing Streak Isn’t a Huge Worry for Markets, Why the Fed Is. And 5 Other Things to Know Today.","The Dow’s Losing Streak Isn’t a Huge Worry for Markets, Why the Fed Is. And 5 Other Things to Know Today.",https://finnhub.io/api/news?id=1c4e595012151510d287773e48ff2e4b3536186988bacdc4540093a0c1d07287
AAPL,1734483595,VTI: Total Market Has Become Too Top Heavy,"Due to its concentration risk, VTI's performance closely mirrors the S&P 500, making it less effective for diversification. Learn more about VTI ETF here.",https://finnhub.io/api/news?id=02c4566f7952023c1065833461501a3784657f00aee82718ea4057258dcb53f6
AAPL,1734478800,Alger Growth & Income Fund Q3 2024 Commentary,"Class A shares of the Alger Growth & Income Fund underperformed the S&P 500 Index
during the third quarter of 2024. Click here to read the full commentary. ",https://finnhub.io/api/news?id=af8c081daf574761b31990dd3ee2da899cea4fcbedb3678b159dd007064ab70e
AAPL,1734471131,"Arm, Qualcomm lawyers grill ex-Apple exec in chip design battle","Attorneys for Arm and Qualcomm grilled a former Apple executive on Tuesday about a key question for the future of the chip industry: Who owns the intellectual property built on top of Arm's computing architecture?  At stake in a trial in U.S. federal court in Delaware this week is the fate of Qualcomm's push into the laptop business, where it is helping partners such as Microsoft  try to regain ground that Windows computers lost to Apple after the iPhone maker introduced its own custom chips.  Arm's flagship product is a computing architecture that competes against Intel's architecture and is ubiquitous in smartphones and increasingly used in laptops and data centers.",https://finnhub.io/api/news?id=261289be9951491b78bb7ca96dcc64cfaffff0843754e8a1437242b7dffd2312
AAPL,1734468107,Why the 'Magnificent 7' rally could be a ‘defensive’ move,Wall Street strategists believe investors are seeking safety in the market's most consistent performers as nervousness grows about the path forward for interest rates in 2025.,https://finnhub.io/api/news?id=a8a4b89a0c04b5026f9709cc72f11cdb2e910755c8117519e9a4424497270d94
