symbol,date,headline,summary,url
AAPL,1735207560,4 of Wall Street's Most Prominent Artificial Intelligence (AI) Stocks Have Made a Shocking $1.23 Trillion Investment,"Nvidia, Meta Platforms, Alphabet, and Apple have collectively spent far more on this than they have on developing artificial intelligence (AI) solutions.",https://finnhub.io/api/news?id=b0a64d71b5d6051a38e4c39389c062dac891e04b707e5b075c206bd5a05e83ca
AAPL,1735205100,Prediction: 2 AI Stocks Will Be Worth More Than Apple Stock by Year-End in 2025,"Apple is currently the most valuable publicly traded company in the world, with a market value of $3.9 trillion.  The company has held that title for the better part of a decade but has yet to demonstrate it can monetize artificial intelligence (AI).  Nvidia (NASDAQ: NVDA) is currently worth $3.4 trillion.",https://finnhub.io/api/news?id=f27925e21278db9af282fb8538b4b37501cc5053b25afbeca54725f60105a7f1
AAPL,1735178400,Flying Was Already the Worst. Then America Stopped Using Headphones.,"Some travelers are confronting people who think it’s OK to have phone conversations on speaker, but it doesn’t always end well",https://finnhub.io/api/news?id=c33d29b1f8ae68e0d1054c50216e40095916aeca7189fddbdbf2530d7b2b4be1
AAPL,1735173949,JGRO: Losing Steam Compared To Its Peers,"JGRO's performance was promising in its first 20 months, but it has lagged passive large-cap growth ETFs for six months. Read why JGRO ETF is a Hold.",https://finnhub.io/api/news?id=2f6e89fae79deea794936c2ac7d63ab4f3bc65c77a832ce731932580fd5d7833
AAPL,1735122840,35% of Warren Buffett's $296 Billion Portfolio Is Invested in 3 Artificial Intelligence (AI) Stocks,"Since Warren Buffett became the CEO of Berkshire Hathaway (NYSE: BRK.A)(NYSE: BRK.B) in 1965, its stock has delivered a compound annual return of 19.8%.  You won't ever see Buffett chasing the latest stock market trend -- not even one as powerful as artificial intelligence (AI).  With that said, three of the existing stocks in Berkshire's $296 billion portfolio of publicly traded securities are integrating AI into their legacy businesses in very unique ways.",https://finnhub.io/api/news?id=82d623d518271da7337a3007f8338775cc344720bafe6eed756a28c3572eb058
AAPL,1735120800,Nvidia Stock Investors Just Got Bad News From AI Semiconductor Rival Broadcom,"Complex data center workloads like training machine learning models and running artificial intelligence (AI) applications would take a very long time if powered only by central processing units (CPUs).  In that semiconductor vertical, Nvidia (NASDAQ: NVDA) graphics processing units (GPUs) have emerged as the industry standard.  In fact, the company has between 80% and 95% market share in AI accelerators, according to analysts.",https://finnhub.io/api/news?id=a5ac75160dcc89f08d0dcb43c722e70b686b191b2ec0a80e24257faff4763feb
AAPL,1735118940,"Meet the Magnificent Vanguard ETF With 37.6% of Its Portfolio Invested in Nvidia, Apple, and Microsoft","This chart features all eight American technology stocks with valuations of $1 trillion or more, and their respective returns in 2024 so far.  Buying an exchange-traded fund (ETF) with a high level of exposure to those trillion-dollar market leaders might be a simpler option for investors compared to buying them individually.  The Vanguard Mega Cap Growth ETF (NYSEMKT: MGK) offers exactly that -- more than one-third of the entire value of its portfolio is tied up in just three of the names in the chart.",https://finnhub.io/api/news?id=91cc072bed5b78c1dff44ffdd956d06b8b40242921afc63dd8c41fe38184bee9
AAPL,1735104000,Carillon ClariVest Capital Appreciation Fund Q3 2024 Commentary,"During the third quarter of 2024, stock selection contributed the most to Fund performance, while sector allocation detracted.",https://finnhub.io/api/news?id=6baa8059ce85ac5f9c323737fb1dee04564d27f885d6fd788d923941eb2c945e
AAPL,1735084860,This Is the Cheapest Magnificent Seven Stock. It’s Worth Considering for the New Year.,This Is the Cheapest Magnificent Seven Stock. It’s Worth Considering for the New Year.,https://finnhub.io/api/news?id=f00e6e34bfaecbc4850682c5afc2585816318db1b46f79cf92f367220223e6ad
AAPL,1735084860,How smartphones powered the AI boom in 2024,"Samsung, Google and Apple all launched flagship generative AI tools on their devices during the year.",https://finnhub.io/api/news?id=a96e43b1d1afc501f96b55ed9d82add89387d2dc55c8ee48efdbb22df28dc211
AAPL,1735066498,"AI will be viewed as a 'national asset' for the US under Trump, says one trade group CEO","The tech industry is bracing for changes as President-elect Donald Trump returns to the White House in 2025. Chamber of Progress CEO and founder Adam Kovacevic joins Brad Smith and Josh Lipton on Market Domination Overtime to discuss his tech industry outlook. ""One of the, I think, good pieces of news is that President-elect Trump has appointed a number of people from the tech world, venture capitalists, people with tech experience to prominent positions,"" Kovacevic says, noting that this is a ""good sign"" for the industry. He adds that Trump's second term will likely lead to a shift in the US government's attitude toward AI. The Biden administration's ""main approach to artificial intelligence was to say, 'This is an area where we ought to tread carefully, put up guardrails, and focus on safety,'"" Kovacevic says. ""What I think you are going to see with Trump is a pivot from safety to really [seeing] AI as an economic asset for the United States, a national asset for the United States, where we should go out and beat other countries, particularly China in AI."" Watch the video above to hear more about the expected tech landscape in 2025, including the possible TikTok ban, Big Tech execs courting Trump, Musk's role in the US government, and more. To watch more expert insights and analysis on the latest market action, check out more Market Domination Overtime here. This post was written by Naomi Buchanan.",https://finnhub.io/api/news?id=1b73c475cb6fef7bfa6029958a47690e4906aa1118be6cf57fa6c78ea69d349f
AAPL,1735060414,Top Midday Stories: American Airlines Briefly Halts Flights; Starbucks Workers Strike Expected to Expand to Over 300 Stores,All three major US stock indexes were up in late-morning trading Tuesday ahead of an early market cl,https://finnhub.io/api/news?id=8de76f0b0b99a8f833cb1c63b41d356541559f50fe1b5ee3ff00e54e5f90b681
AAPL,1735053603,Apple seeks to defend Google's billion-dollar payments in search case,"Apple has asked to participate in Google's upcoming U.S. antitrust trial over online search, saying it cannot rely on Google to defend revenue-sharing agreements that send the iPhone maker billions of dollars each year for making Google the default search engine on its Safari browser.  Apple does not plan to build its own search engine to compete with Alphabet's Google, whether or not the payments continue, the company's lawyers said in court papers filed in Washington on Monday.",https://finnhub.io/api/news?id=d7d80b4cd8d83fdd36bb040ed7ec86d8c9220ba8dc8cd1194347840963e75878
AAPL,1735051344,Analyst unveils bold Apple stock price forecast in 2025,Apple stock just hit a record high. Here’s what could be next for the iPhone maker.,https://finnhub.io/api/news?id=693a43b23712a3463f41e6383adfe711b3879bc666122a454ab843df8080e86a
AAPL,1735045957,Stock Market Today: Dow Jones Rises As Santa Claus Rally Revs Up; This Stock Warren Buffett Is Selling Hits New High,Stock Market Today: Dow Jones Rises As Santa Claus Rally Revs Up; This Stock Warren Buffett Is Selling Hits New High,https://finnhub.io/api/news?id=1a443d08405efb30027df5c35f40de915e707f084d7a158711e8523dc6953157
AAPL,1735045380,A year in review: the most important tech news stories of 2024,This year brought some truly innovate new products and updates from tech leaders,https://finnhub.io/api/news?id=a21e841bb16f1a5f4893030a4fab08d3ecadc2ba22fd72641974caa0dce3441c
AAPL,1735043040,Zacks Investment Ideas feature highlights: Apple,Apple is a part of the Zacks Investment Ideas article.,https://finnhub.io/api/news?id=5beacbfb5f4db2e76b3f09dd0840689617410d5be1ff318b1e0d83638155897a
AAPL,1735041600,"PayPal Is Skyrocketing, but Here's 1 Warning Before You Buy the Stock",PayPal (NASDAQ: PYPL) is finally starting to attract some bullish sentiment from the investment community.  One obvious warning PayPal shareholders must heed is just how competitive the payments landscape has become.  Visa and Mastercard get a lot of attention because of their duopolistic position in the credit card processing niche.,https://finnhub.io/api/news?id=fe9c470c437723d93cad2c8c94692609371eb4db428ef13f70ec47a0d3f5937b
AAPL,1735038900,1 Unstoppable Vanguard ETF to Buy Hand Over Fist Right Now,"Artificial intelligence (AI) will transform the global economy.  The portfolio's concentrated nature shines through its top holdings, where technology titans Apple (16.2%), Nvidia (15.4%), and Microsoft (13%) command nearly 45% of its total assets.",https://finnhub.io/api/news?id=c5742c92bde8037d472b813b3dd5b21e90bcdf55fa5aad1f44641c7a76fca1ad
AAPL,1735038047,Nvidia dominated 2024 big-time. Next year? Plenty of challenges.,"Nvidia dominated 2024, and 2025 is looking just as good. But there's turbulence on the horizon.",https://finnhub.io/api/news?id=0085398ccea7067f72a5152dbcd68bb7486a80d65d6400152a51f4bfcf8f0b66
AAPL,1735036633,"Latest Survey Shows Apple (AAPL) iPhone 16 Market Share, Momentum Lower Year Over Year","We recently published a list of Top 10 AI Stocks to Watch Right Now. In this article, we are going to take a look at where Apple Inc (NASDAQ:AAPL) stands against other top AI stocks to watch right now. Tom Hancock, GMO U.S. quality ETF portfolio manager, said in a latest program on CNBC that […]",https://finnhub.io/api/news?id=7060318fd9d308c86219a2fa744533d849fab31364f67fcd2877d6eeee6aa86a
AAPL,1735035852,"Trending tickers: Nvidia, TSMC, Apple, Honda and Vistry",The latest investor updates on stocks that are trending on Tuesday.,https://finnhub.io/api/news?id=da11a0a20e8bf8d3aac24288e11d61175799806a3b7cfed6c2d0c03341c1bd15
AAPL,1735035300,Want to Buy Shares of Warren Buffett's Investment Empire Before 2024 Is Over? Consider These 5 Magnificent Vanguard ETFs That Own Berkshire Hathaway Stock.,"Warren-Buffett-led Berkshire Hathaway (NYSE: BRK.A) (NYSE: BRK.B) is known for holding sizable stakes in public equities such as Apple, American Express, Bank of America, Coca-Cola, and Chevron.  Exchange-traded funds (ETFs) that hold Berkshire Hathaway offer a way to tap into Buffett's investment empire while maintaining diversification.  Berkshire Hathaway stock is a holding in many funds, including low-cost ETFs offered by investment management company Vanguard.",https://finnhub.io/api/news?id=6fe48cbbdbaefedcb62f357dda5afed6123e446af6c5db0c662658f02279eaa9
AAPL,1735033635,Dow Jones Falls As Nvidia Hits Key Level; AI Chip Leader TSMC Breaks Out,Dow Jones Falls As Nvidia Hits Key Level; AI Chip Leader TSMC Breaks Out,https://finnhub.io/api/news?id=e553d4f8cb2d401ff98561d09327f0d8501745083c8ec87c028c214247730589
AAPL,1735032600,"2025 Analyst Outlook: Envision Research On AI, Dividends And Barbell Investing",Equity valuations are at lofty levels. Read why investors should not expect more of the same returns in 2025.,https://finnhub.io/api/news?id=1ca574d6dfbce9d2cc55dcc9488998e2fcd0518cf76ed622e9d094bd3c9bd27d
AAPL,1735032600,Foxconn invests in EV battery plant in China to diversify business beyond Apple's iPhones,"Major Apple supplier Foxconn Technology Group is injecting 600 million yuan (US$82 million) into a new electric-vehicle (EV) battery plant in Zhengzhou, capital of central Chinese province Henan, where it runs the world's largest iPhone factory. The company, formally known as Hon Hai Precision Industry, on Monday announced its ""long-term investment"" in Foxconn New Energy Battery (Zhengzhou), which was established in October, according to a filing to the Taiwan Stock Exchange. The initial capital",https://finnhub.io/api/news?id=0d4b64ea4796a3da035b64ab1f64b772302421d70bbd5eb6b4888080c8dcd201
AAPL,1735002360,Where Will Apple Stock Be in 1 Year?,"Apple (NASDAQ: AAPL) has done its part to lift the holiday spirits of its shareholders as 2024 comes to an end.  Indeed, Apple's 269% return in just the past five years has more than tripled the S&P 500 index's 82% gain over the same period.  Let's explore where Apple stock might be by this time next year.",https://finnhub.io/api/news?id=ea9e5c7e9ee158b75b0a80e8547f96136ed6f906df2a2abe300e3c70185f6d4f
AAPL,1734990960,"Retail investors are 'optimistic,' but 'realistic' going into 2025","Retail investors are feeling bullish about the market (^DJI, ^IXIC, ^GSPC) in 2025, eToro's fourth quarter Retail Investor Beat shows. eToro investment analyst Bret Kenwell joins Josh Lipton and Seana Smith on Market Domination to discuss how retail investors are thinking about the market headed into the new year. Kenwell says retail investors are ""optimistic"" but ""realistic"" for the new year. ""They're looking to gain more exposure to crypto in 2025. They're looking to gain more exposure to equities in 2025. But they're also looking to raise some cash here,"" he says, later adding: ""I think they're being prudent, but also, you know, keeping one foot in at least is so they keep getting taking advantage of, you know, more gains to come in 2025 if that is the case."" The analyst reports that the survey found retail investors to prefer the financials sector and big-cap tech, including Magnificent Seven names and other artificial intelligence (AI) plays. To watch more expert insights and analysis on the latest market action, check out more Market Domination here. This post was written by Naomi Buchanan.",https://finnhub.io/api/news?id=c3b459599b84c2e2d0d7300fe26d2a6eb1f8607c3c353cbc2736fce05ad0a7d9
AAPL,1734990098,"""Real-world AI"" is the next phase of this tech: Portfolio mgr.","Nightview Capital portfolio manager Dan Crowley discusses the transformative potential of artificial intelligence (AI) in 2025 on Market Domination Overtime. ""We think we're headed toward a period of rapid technological shifts. Historically, whenever that's happened, significant opportunities have been unlocked,"" Crowley explains. He believes AI's economic impact could rival that of the internet revolution. Crowley identifies ""real-world AI"" as the sector's next evolution, highlighting two key investment opportunities. First, he points to ""entirely new product-category"" companies like Tesla (TSLA), which is advancing autonomous driving technology. Second, he sees potential in established companies with ""existing business lines,"" such as Amazon (AMZN), which can leverage AI to enhance operational efficiency. ""We're kind of trying to move into the next phase here of where we see AI playing out,"" he tells Yahoo Finance. To watch more expert insights and analysis on the latest market action, check out more Market Domination Overtime here. This post was written by Angel Smith",https://finnhub.io/api/news?id=194928e0fc14ebc2a1bdd62a6703d4abcf06d93653b8a479b24d4c9725c4c49c
AAPL,1734988258,Apple Seen Having Strong Holiday Sales. Stock Hits Record High.,Apple stock notched a record high after a Wall Street analyst said the consumer electronics giant is likely to have strong holiday season sales.,https://finnhub.io/api/news?id=e2396cc4c8590820e50130f0192bd584fb88ae6cfaf71d2b4f9cf4d73d1a6e7d
AAPL,1734980911,"Tesla, Meta and Broadcom Weights Shrink in Nasdaq 100 Rebalance","(Bloomberg) -- Three of the world’s biggest companies have had their influence reduced in the Nasdaq 100 Index after the giant technology rally of 2024 swelled them to unprecedented size.Most Read from BloombergHo Chi Minh City Opens First Metro Line After Years of DelayThe Architects Who Built MiamiReviving a Little-Known Modernist Landmark in BuffaloNew York’s Congestion Pricing Plan Still Faces Legal HurdlesNew York City’s Historic Preservation Movement Is Having a Midlife CrisisTesla Inc., M",https://finnhub.io/api/news?id=c6267f02e784ccfd42f1254d5ce426f8d57002decf40ecc19e7663a8f11a0cc8
AAPL,1734978571,Why Broadcom Was Rallying Again Today,"Shares of Broadcom (NASDAQ: AVGO) rallied 5.3% on Monday, as of 1:18 p.m. ET.  Broadcom received a bullish note and price target upgrade from a Wall Street sell-side analyst today, building upon the blowout 2027 guidance management gave on the company's recent earnings call.  On Monday, UBS analyst Timothy Arcuri raised his target on Broadcom from $220 to $270 per share, while maintaining his bullish stance on the name.",https://finnhub.io/api/news?id=e3ad6e475666cec6cd075f4dcb00d5f3285f96e6dae79b4130ecf58486310486
AAPL,1734973883,"Apple Set to See Growth Due to iPhone 16 Upgrades, 'Strong' Holiday Season, Wedbush Says","Apple (AAPL) is set to see growth over the next 12 to 18 months due to iPhone 16 upgrades that are """,https://finnhub.io/api/news?id=f88e9b1f99a8bbc75c9c35825d004f4c383f8b5731c5199297a612aa984d4c0f
AAPL,1734972686,"Taiwan Semi Breaks Out As Funds Load Up On Apple, These 2024 Winners","Taiwan Semi Breaks Out As Funds Load Up On Apple, These 2024 Winners",https://finnhub.io/api/news?id=07bf97036dffb29ed4d583a67abaeef06df01947a917f5c1a19d7e755d389fc0
AAPL,1734972344,"CFPB vs. Walmart, iPhone 16, Apollo and Workday: Top Stocks","The Consumer Financial Protection Bureau (CFPB) is suing retailer Walmart (WMT) for forcing its delivery drivers to use pricey deposit accounts in order to receive payments. Wedbush senior analyst Dan Ives published a note stating that the global demand for Apple's iPhone 16 (AAPL) has increased slightly above expectations. Apollo Global Management (APO) and Workday (WDAY) have begun trading on the S&P 500 (^GSPC) on Monday. Disclosure: Yahoo Finance is owned by Apollo Global Management. To watch more expert insights and analysis on the latest market action, check out more Wealth here. This post was written by Luke Carberry Mogan.",https://finnhub.io/api/news?id=df6400c4277199f5d0f3bba180cb24c237ceeaf6da3ac8c8ce9567eed624b32a
AAPL,1734971520,"Apple Inc. stock rises Monday, still underperforms market","Apple Inc. stock rises Monday, still underperforms market",https://finnhub.io/api/news?id=f0c21674271b7f3d9cdb2493e15b1945941449f3f63bb3cb60bac4666e3d36a0
AAPL,1734971341,"Here’s Why Nvidia (NVDA) Is A Long Game, Longer Than You Think","Nvidia has lately been in the headlines for all the wrong reasons. They are having trouble shipping Blackwell GPUs, facing regulatory pressure in China, and justifying to the US government how its chips ended up in China’s hands. Amidst all this, its stock has hardly gone anywhere in the last 6 months but is still […]",https://finnhub.io/api/news?id=e18a68b70922b3c1cebdb11380c6b5c89a8213b89faaa6286d6232e2f6774f7d
AAPL,1734971160,Apple Stock Hits All-Time High: Is the Tech Giant Too Extended?,Buying stocks when they make new highs has proven to be profitable throughout history.,https://finnhub.io/api/news?id=88b11e4bb8c21522147d3ca28aa655fcc34a1f2acbcb1ec68a6cb39ee306ee1c
AAPL,1734970020,Google Counters Breakup Proposals. How Alphabet Stock Could Benefit.,A judge ruled in August that the company has a monopoly in general search services and general text advertising. The question now is what should be done about it.,https://finnhub.io/api/news?id=8a80426ac0eb356f8393df79f3a2abc81c5a874096e9eb7c63bf8d162d340b1a
AAPL,1734969240,More & More Regulations Under Trump: How Will Tech Giants Cope in 2025?,"In Trump's second term, tech giants like GOOGL, MSFT, META and AAPL face tough regulations on AI, antitrust and privacy.",https://finnhub.io/api/news?id=bb216ece9b184f0d73c7090e2f5c5f087831ebe727538b8eb7b554a622ee8635
AAPL,1734967740,Apple Stock Edges Up. How the iPhone 16 Could Send It Even Higher.,"Apple  biggest supporter is predicting a powerful end to 2024, driven by robust iPhone sales during Christmas, setting the stage for the tech company to hit a $4 trillion market value.  In a note on Monday, Wedbush’s Daniel Ives wrote that he believes Apple is set to have a strong holiday season as iPhone 16 upgrades are trending well as Christmas nears, based on recent checks of supply chains in Asia.  Currently, 100 million iPhones in China alone could be upgraded, or replaced with newer devices, in 2025, Ives estimates.",https://finnhub.io/api/news?id=09e5549c8e37a6787d3d4aa550cd8ac0f1660722970e7e51dc7178b108773b72
AAPL,1734966259,Wedbush Sets $300 Target: Apple's AI and iPhone 16 Drive Momentum in Holiday Season,"Apple's iPhone 16 demand outpaces forecasts, as AI platform gains traction and global rollouts loom.",https://finnhub.io/api/news?id=0807d9de25a6e759a594248bc93245e8100fc866680e916c6c1bcff4f410003c
AAPL,1734966000,How Two Strategic Picks Boost Income And Reduce Risks: One Yields Above 8%,Discover how incorporating BB Seguridade and Schwab Short-Term U.S.,https://finnhub.io/api/news?id=99562239c42f0ce811ae453cd21cbca60d9371fc683fb81550389462d397e781
AAPL,1734962860,Nvidia stock is in a 'soul-searching' moment,"Nvidia's stock might be cooling, but is it something to worry about?",https://finnhub.io/api/news?id=a80a3ae9094a65c8affe0ea33a260dd12ea98b5fa251aefc7fbaa4c8600ee293
AAPL,1734962744,BE Semiconductor Set to Capitalize on Growth from Apple and Nvidia Innovations,Expected to benefit from Apple's iPhone 18 Pro and M5 chip series using hybrid bonding and SOIC packaging.,https://finnhub.io/api/news?id=e2976660ec8d68f68f881cd57bb35e3cdb7bcbcd971353d928eb7db639bb6536
AAPL,1734962414,Apple Inc. (AAPL) is Attracting Investor Attention: Here is What You Should Know,"Apple (AAPL) has been one of the stocks most watched by Zacks.com users lately. So, it is worth exploring what lies ahead for the stock.",https://finnhub.io/api/news?id=f846dc4549cd514a45fd57d82fc1e2186a4ec2ed644942efc4ef1ac01bc4ee23
AAPL,1734962366,Wedbush Predicts Apple's iPhone 16 Sales Could Hit 240M Units in 2025,"Apple's iPhone 16, Powered by AI, Poised to Break Sales Records This Holiday Season",https://finnhub.io/api/news?id=dc8e4620753b5f1a5d3af3774900ce1127580ad2f220a6265109b67ca2df8fe2
AAPL,1734961800,Yearly Portfolio Review - November Dividend Income Report,"My top 10 is healthy, with a large position in Apple at 9.64%, then drops to 7.46% for Couche-Tard and 5.99% for National Bank. Read more here.",https://finnhub.io/api/news?id=7adb433f2f9fe5cb618b29ddbac8084ec89374e9246d5baadf6e3b4128e1774e
AAPL,1734961440,Apple to see strong Christmas iPhone sales that launch a ‘renaissance of growth’,Apple to see strong Christmas iPhone sales that launch a ‘renaissance of growth’,https://finnhub.io/api/news?id=59c80fbafc447a054117178e7c8b5fb80d3085d86829a2bde61a7f11aaf05089
AAPL,1734957540,"If Mars Attacks the Rally, Drones Should Drive Diversification","If Mars Attacks the Rally, Drones Should Drive Diversification",https://finnhub.io/api/news?id=9eafd94d6ca165fc34457e53428cf5e3c2e02d322eec3294d648bff280ad167b
AAPL,1734951780,"Warren Buffett Recently Shunned His Favorite Stock for the First Time Since 2018, and It Could Spell Bad News for Wall Street","It was 1965 when Warren Buffett became the CEO of Berkshire.  Berkshire is also sitting on $325 billion in cash, which Buffett and his team can put to work when they spot new opportunities.  According to the conglomerate's 13-F filings, he is on a major selling spree in 2024.",https://finnhub.io/api/news?id=cb3150fed66588e66f012a38e712acae41d37bb372aa43f2b6543ad41e9ca304
AAPL,1734948000,History Says the Nasdaq Could See Strong Gains in 2025: Here Are the Top Nasdaq Stocks From Warren Buffett and Bill Ackman Going Into the New Year,"The stock market is so hot that I'm struggling to wrap my mind around the numbers.  As of this writing, the Nasdaq Composite Index (NASDAQINDEX: ^IXIC) is up 30% in 2024.  According to MacroTrends, the Nasdaq Composite Index has gone up by 30% or more in 13 other years since 1972 (the index's first full year).",https://finnhub.io/api/news?id=30b8e3f88b4f5da994fdd7958263de737dbf6c49e7b2f4eeab10a1a72fd3f825
AAPL,1734947897,"Dow Jones Falls After Funding Bill Averts Shutdown; Nvidia, Tesla Rally","Dow Jones Falls After Funding Bill Averts Shutdown; Nvidia, Tesla Rally",https://finnhub.io/api/news?id=2217e3bac0b64eaa53668bf02e92de11be59f702a465989809a17b8b5812f3a9
AAPL,1734946093,"Apple: 4,000 billion capitalization in sight, according to Wedbush","Wedbush reaffirms its 'outperform' rating and $300 price target on Apple, deeming it 'on track to reach the $4,000 billion market capitalization threshold by early 2025, and to be the first member of...",https://finnhub.io/api/news?id=51f6aa2018d8b7279592ef478977d111cdd69a2709d3fa5913037e20277529be
AAPL,1734946020,Why You Should Not Trade Apple Stock Like You're Warren Buffett,"Despite a rapidly changing tech landscape, few investors are likely to dispute the assertion that Apple (NASDAQ: AAPL) stock will remain a long-term winner.  While its artificial intelligence (AI) capabilities may not receive as much attention as those of Nvidia or Palantir, its massive resources, improving technology, and customer loyalty will likely keep the company a major force in its industry for some time to come.  Knowing those attributes, investors may have trouble reconciling the investment case for Apple, considering that Warren Buffett's Berkshire Hathaway (NYSE: BRK.A) (NYSE: BRK.B) sold a large chunk of its shares.",https://finnhub.io/api/news?id=29ee4e1f02b8bc12eea09f086c6bdb6731c599f2100186d8f9a525d5cfbcf384
AAPL,1734944485,Apple unveils smart doorbell camera with Face ID technology,Copyright © BusinessAMBE 2023Key takeawaysThe smart doorbell camera unlocks doors with Face ID technology.The device will feature Apple's Secure Enclave chip for secure storage and processing...,https://finnhub.io/api/news?id=dd018811720f51b101bd831a108324c1aae7080d79ec4c3af396e0aed6980f81
